source,author,title,description,url,urlToImage,publishedAt,content
"{'id': None, 'name': 'Faz.net'}",Klaus Max Smolka,Großübernahme: Milliardendeal um Aareon,"Die Aareal Bank und der Finanzinvestor Advent verkaufen den Anbieter von Immobiliensoftware Aareon. Die IT-Gesellschaft wird mit 3,9 Milliarden Euro bewertet. Besonders interessant ist ein sonst selten genanntes Detail: die Höhe der Transaktionskosten.",https://www.faz.net/aktuell/finanzen/grossuebernahm-milliardendeal-um-aareon-19810745.html,https://media1.faz.net/ppmedia/aktuell/2190707974/1.9554893/facebook_teaser/die-zentrale-der-aareal-bank.jpg,2024-06-24T15:18:25Z,"Aareon wird den Angaben zufolge in der Transaktion mit 3,9 Milliarden Euro bewertet, was diese zu einer der größten in Deutschland im bisherigen Jahresverlauf macht. Das Geschäft mit Fusionen und Übe… [+1300 chars]"
"{'id': None, 'name': 'DIE WELT'}",Cornelius Welp,Deutsche Unternehmen im Visier – vier Branchen reizen die Araber besonders,Investoren aus dem Nahen Osten greifen nach dem Chemiekonzern Covestro und der Bahn-Tochter Schenker. Das Selbstbewusstsein arabischer Bieter ist gewachsen. Auf die möglichen Deals dürften schon bald weitere folgen. Vielen hiesigen Unternehmen kommt das sogar…,https://www.welt.de/wirtschaft/article252266032/Deutsche-Unternehmen-im-Visier-4-Branchen-reizen-arabische-Investoren-besonders.html,https://img.welt.de/img/wirtschaft/mobile252301802/4781352467-ci16x9-w1200/COP28-president-Sultan-Ahmed-Al-Jaber-sp.jpg,2024-07-02T10:14:49Z,Das Leben von Klaus Fröhlich ist so etwas wie ein Musterbeispiel für die verschlungenen Wege wahrhaft globaler Karrieren. Der in Mexiko geborene deutsche Manager hat in London studiert und anschließe… [+6842 chars]
"{'id': None, 'name': 'DW (English)'}",Nik Martin,KI: Wie riskant ist die Dominanz von Microsoft und Nvidia?,Die beiden Tech-Giganten beherrschen das Rennen um Künstliche Intelligenz. US-Kartellbehörden nehmen sie jetzt unter die Lupe. Helfen strengere Regeln dem Wettbewerb oder schaden sie der gesamten Branche? Microsoft und Nvidia haben bei Künstlicher Intelligenz…,https://www.dw.com/de/ki-wie-riskant-ist-die-dominanz-von-microsoft-und-nvidia/a-69399792,https://static.dw.com/image/69386346_6.jpg,2024-06-18T14:21:00Z,"Microsoft und Nvidia haben bei Künstlicher Intelligenz (KI) eine Spitzenposition. Die beiden Firmen sind an der Börse zusammen 6,6 Billionen US-Dollar (6,16 Billionen Euro) wert bilden mit Apple die … [+6649 chars]"
"{'id': None, 'name': 'Faz.net'}",Klaus Max Smolka,M&A-Markt: Konzerne bestimmen das Geschäft mit Fusionen und Übernahmen,Das Übernahmevolumen auf der Welt steigt dieses Jahr bisher – obwohl der Hilfsmotor Private Equity stockt. Deutschland fällt aus dem Rahmen.,https://www.faz.net/aktuell/finanzen/finanzmarkt/m-a-markt-konzerne-bestimmen-das-geschaeft-19781520.html,https://media1.faz.net/ppmedia/aktuell/wirtschaft/1887160215/1.9781517/facebook_teaser/uebernahmeziele-sind-gemeinhin.jpg,2024-06-11T15:02:15Z,"Dies zeigt eine Erhebung, welche der Datendienstleister Dealogic für die F.A.Z. erstellt hat. Fachleute sehen momentan die treibende Kraft im Geschäft mit Fusionen und Übernahmen (Mergers &amp; Acqui… [+7168 chars]"
"{'id': None, 'name': 'Süddeutsche Zeitung'}",Von Elisabeth Dostert,Automation: Deutsche Firmen unter Druck,"Anbieter aus China drängen mit Robotern nach Europa – auch, weil für sie in den USA kaum mehr Abnehmer finden. Und die Unternehmen hier klagen: Mit der Geschwindigkeit könnten sie nicht mithalten.",https://www.sueddeutsche.de/wirtschaft/maschinenbau-vdma-robotik-und-automation-lux.Pow7k3ehWt9M8ZFjkdmyct,https://www.sueddeutsche.de/2024/06/17/409305e1-c6f6-4e08-ba67-dc5c36e8eb0e.jpeg?q=60&fm=webp&width=1200&rect=0%2C833%2C2920%2C1643,2024-06-17T09:01:14Z,"Wir haben alles, um Fabriken für Batterien oder Brennstoffzellen auszustatten, sagt Konrad. Er ist auch Chef der Firma Hahn Automation aus Rheinböllen mit mehr als 1800 Mitarbeitern und etwa 300 Mill… [+3993 chars]"
"{'id': None, 'name': 'N-tv.de'}",n-tv NACHRICHTEN,"Volkswirtin zum US-TV-Duell: Die Finanzmärkte werden sich Trumps Sieg ""schönsaufen""","Die US-Demokraten sind in Panik nach Bidens katastrophaler Performance beim TV-Duell. Während eine Rückkehr Trumps ins Weiße Haus insbesondere für Europa problematisch wäre, erscheint dessen Agenda für die Finanzmärkte positiv, sagt Volkswirtin Sandra Ebner -…",https://www.n-tv.de/wirtschaft/Die-Finanzmaerkte-werden-sich-Trumps-Sieg-schoensaufen-article25050081.html,https://bilder3.n-tv.de/img/incoming/crop25050082/7971323902-cImg_16_9-w1200/470109052.jpg,2024-06-28T12:06:38Z,Die US-Demokraten sind in Panik nach Joe Bidens katastrophaler Performance beim TV-Duell. Während eine Rückkehr Donald Trumps ins Weiße Haus insbesondere für Deutschlands Unternehmen problematisch wä… [+3426 chars]
"{'id': 'focus', 'name': 'Focus'}",Deutsche Welle Wirtschaft,- KI: Wie riskant ist die Dominanz von Microsoft und Nvidia?,Die beiden Tech-Giganten beherrschen das Rennen um Künstliche Intelligenz. US-Kartellbehörden nehmen sie jetzt unter die Lupe. Helfen strengere Regeln dem Wettbewerb oder schaden sie der gesamten Branche?,https://www.focus.de/finanzen/news/ki-wie-riskant-ist-die-dominanz-von-microsoft-und-nvidia_id_260061194.html,https://p6.focus.de/img/finanzen/news/id_260061193/us-wettbewerbshueter-wollen-bei-nvidia-und-microsoft-nun-genauer-hinschauen.jpg?im=Crop%3D%280%2C29%2C940%2C470%29%3BResize%3D%281200%2C627%29&impolicy=perceptual&quality=mediumHigh&hash=2d7ec9263e4d817c898955a690a845007267f4ff5333d140c372f4baaa16ca90,2024-06-18T14:40:05Z,"Microsoft und Nvidia haben bei Künstlicher Intelligenz (KI) eine Spitzenposition. Die beiden Firmen sind an der Börse zusammen 6,6 Billionen US-Dollar (6,16 Billionen Euro) wert bilden mit Apple die … [+6149 chars]"
"{'id': None, 'name': 'Orf.at'}",ORF.at,Hilfspaket für finanzmarode Gemeinden,"Die Gemeinden klagen seit Langem, dass ihre Pflichten mittlerweile ihre Mittel übersteigen. Manche erwägen aus Kostengründen gar eine Fusion mit anderen Orten. Zum Abschluss der Nationalratssaison steht ein Hilfspaket im Umfang von 920 Millionen Euro an.",https://orf.at/stories/3362463/,https://ibs.orf.at/news?image=https%3A%2F%2Fassets.orf.at%2Fmims%2F2024%2F27%2F19%2Fcrops%2Fw%3D1200%2Ch%3D630%2Cq%3D75%2F2266231_master_861719_nationalrat_gemeinden_hilfspaket_2_coe.jpg%3Fs%3D0b2d6303f3c1679f68c6fe531f0bcd240b71866a,2024-07-03T15:50:51Z,Es gibt zahlreiche finanziell leistungsfähige Gemeinden. Das zeigte am Mittwoch etwa eine Auswertung des Zentrums für Verwaltungsforschung (KDZ). Laut KDZ führt Elixhausen in Salzburg das Ranking der… [+5902 chars]
"{'id': None, 'name': 'Www.nzz.ch'}",Gerald Hosp (gho),Die Welt wird in Öl schwimmen. Das ist ein Problem für Petro-Staaten wie Saudiarabien und Russland.,Die Internationale Energieagentur sagt den Anfang des Endes des Erdölzeitalters voraus. Gleichzeitig soll die Welt im Öl schwimmen. Das ist ein Problem für die Länder von Opec+.,https://www.nzz.ch/wirtschaft/die-petro-staaten-verlieren-an-bedeutung-am-erdoelmarkt-nicht-nur-weil-die-nachfrage-zurueckgeht-ld.1834737,"https://img.nzz.ch/2024/06/12/bd4325fe-4d1f-4828-866d-6be806573621.jpeg?width=1200&height=674&fit=bounds&quality=75&auto=webp&crop=5935,3338,x0,y309&wmark=nzz",2024-06-13T03:30:00Z,"Der saudische Energieminister Abdelaziz bin Salman und Russlands Vizeministerpräsident Alexander Nowak sprechen sich an einem Wirtschaftsforum in St. Petersburg gegenseitig Mut zu.
Der saudische Ene… [+6783 chars]"
"{'id': None, 'name': 'Diepresse.com'}",Die Presse,"OMV-Chef Alfred Stern: „Gasproduktion in Europa ist das Beste, was wir tun können“","Europa wird noch lange Erdgas brauchen – am besten aus eigener Erzeugung, sagt OMV-Chef Alfred Stern. Er erklärt, warum das den grünen Umbau des Konzerns beflügeln statt bremsen wird, spricht über politische Zwischenrufe und den Irrglauben, dass die Nachfrage…",https://www.diepresse.com/18565750/omv-chef-alfred-stern-gasproduktion-in-europa-ist-das-beste-was-wir-tun-koennen,https://img.diepresse.com/public/incoming/hfbki1-OMV-CEO-Alfred-Stern-speaks-at-an-interview/alternates/DPR_SOCIAL_MAGAZIN/OMV%20CEO%20Alfred%20Stern%20speaks%20at%20an%20interview,2024-06-14T08:49:50Z,"Europa wird noch lange Erdgas brauchen am besten aus eigener Erzeugung, sagt OMV-Chef Alfred Stern. Er erklärt, warum das den grünen Umbau des Konzerns beflügeln statt bremsen wird, spricht über poli… [+7713 chars]"
"{'id': None, 'name': 'Faz.net'}",Jessica Ramczik,Wie antisemitisch war die Fusion?,Das Fusion-Festival ist vorbei – das Ringen der Festival- und Clubszene um die Deutungshoheit im Nahostkonflikt geht weiter. Eine Bestandsaufnahme.,https://www.faz.net/aktuell/feuilleton/debatten/wie-antisemitisch-war-die-fusion-19835213.html,https://media1.faz.net/ppmedia/aktuell/3870130053/1.9835211/facebook_teaser_fplus/solidaritaetsaktion-fuer-die.jpg,2024-07-06T08:39:50Z,"Es ist Ende Juni, und mitten im ländlichen Mecklenburg-Vorpommern, auf einem alten sowjetischen Militärflugplatz in Lärz, findet zum 24. Mal das Fusion-Festival statt. Was 1997 als kleines Treffen vo… [+860 chars]"
"{'id': 'die-zeit', 'name': 'Die Zeit'}",ZEIT ONLINE: News -,Festivals: Nach regenreicher Nacht: Letzter Tag des Fusion-Festivals,Hier finden Sie Informationen zu dem Thema „Festivals“. Lesen Sie jetzt „Nach regenreicher Nacht: Letzter Tag des Fusion-Festivals“.,https://www.zeit.de/news/2024-06/30/nach-regenreicher-nacht-letzter-tag-des-fusion-festivals,https://img.zeit.de/news/2024-06/30/nach-regenreicher-nacht-letzter-tag-des-fusion-festivals-image-group/wide__1300x731,2024-06-30T12:45:18Z,"Mit DJ Matthias Tanzmann, dem Hamburger Duo Extrawelt und Techno-DJ Josh Wink ist das Fusion-Festival in Mecklenburg-Vorpommern am Sonntag in seinen fünften und letzten Tag gestartet. Die Unwetter in… [+2855 chars]"
"{'id': None, 'name': 'tagesschau.de'}",Ingo Nathusius,Durch Fusion entsteht die größte Volksbank Deutschlands,"In Frankfurt am Main entsteht die größte deutsche Volksbank, deren Geschäftsgebiet sich über hundert Kilometer erstreckt: von Weilburg in Mittelhessen bis Weibersbrunn im bayerischen Spessart. Von Ingo Nathusius.",https://www.tagesschau.de/wirtschaft/finanzen/volksbanken-fusion-100.html,https://images.tagesschau.de/image/fec786f8-32cf-4704-a0d7-8d6b1df3f869/AAABkFho5d0/AAABjwnlFvA/16x9-1280/volksbank-118.jpg,2024-06-27T12:56:24Z,"Stand: 27.06.2024 14:56 Uhr
In Frankfurt am Main entsteht die größte deutsche Volksbank, deren Geschäftsgebiet sich über hundert Kilometer erstreckt: von Weilburg in Mittelhessen bis Weibersbrunn im… [+3711 chars]"
"{'id': None, 'name': 'Golem.de'}",Werner Pluta,"(g+) Gauss Fusion: ""Das erste Fusionskraftwerk wird in den 2040ern kommen""","Magnet oder Laser, Stellarator oder Tokamak? Bei Gauss Fusion aus München arbeitet man hart an der Kernfusion - und hofft, dass das erste Kraftwerk bald in Europa stehen wird. Ein Interview von Werner Pluta (Forschung in D, Interview)",https://www.golem.de/sonstiges/zustimmung/auswahl.html?from=https%3A%2F%2Fwww.golem.de%2Fnews%2Fgauss-fusion-das-erste-fusionskraftwerk-wird-in-den-2040ern-kommen-2406-185350.html&referer=https%3A%2F%2Ft.co%2F5c5a8d2e74,,2024-06-09T08:00:01Z,"Besuchen Sie Golem.de wie gewohnt mit Werbung und Tracking,
 indem Sie der Nutzung aller Cookies zustimmen.
 Details zum Tracking finden Sie im Privacy Center.
Skript wurde nicht geladen. Informat… [+607 chars]"
"{'id': None, 'name': 'Caschys Blog'}",caschy,macOS 15 virtualisieren,"Wir haben hier in den vergangenen Jahren schon häufig darüber berichtet, wie man unterschiedliche Systeme virtualisieren kann. Unter macOS gibt es da unter anderem VirtualBox, UTM, Parallels, das mittlerweile für den Privatgebrauch kostenfreie VMWare Fusion, …",https://stadt-bremerhaven.de/macos-15-virtualisieren/,https://stadt-bremerhaven.de/wp-content/uploads/2024/06/virtualbuddy.jpg,2024-06-14T18:00:09Z,"Wir haben hier in den vergangenen Jahren schon häufig darüber berichtet, wie man unterschiedliche Systeme virtualisieren kann. Unter macOS gibt es da unter anderem VirtualBox, UTM, Parallels, das mit… [+1839 chars]"
"{'id': None, 'name': 'heise online'}",Eva-Maria Weiß,Projekte von Sam Altman: Fusionsenergie von Helion für OpenAI,Helion will Fusionskraftwerke bauen. Die Energie daraus möchte sich OpenAI sichern. Das Geschäft ist in doppelter Hinsicht ein Gewinn für Altman.,https://www.heise.de/news/OpenAI-will-Fusionsenergie-von-Helion-dessen-Investor-ist-Sam-Altman-9755195.html,https://heise.cloudimg.io/bound/1200x1200/q85.png-lossy-85.webp-lossy-85.foil1/_www-heise-de_/imgs/18/4/6/0/9/6/5/1/shutterstock_2366323229-ae60908f7878a8a0.jpg,2024-06-10T10:04:00Z,"OpenAI und Helion sind in Gesprächen über eine Zusammenarbeit beziehungsweise darüber, ob das KI-Unternehmen in Zukunft Energie aus den Fusionskraftwerken von Helion bekommen kann. Allerdings gibt es… [+2300 chars]"
"{'id': None, 'name': 'heise online'}",Andreas Wilkens,ITER soll neuen Zeitplan bekommen,Die Projektbetreiber des Kernfusions-Forschungsprojekts ITER reagieren auf einige technische und andere Probleme in den vergangenen Jahren.,https://www.heise.de/news/ITER-soll-neuen-Zeitplan-bekommen-9780401.html,https://heise.cloudimg.io/bound/1200x1200/q85.png-lossy-85.webp-lossy-85.foil1/_www-heise-de_/imgs/18/4/6/2/2/8/8/2/vvs_repairs_simic_ansaldo_1-2-f0038c404b389285.jpg,2024-06-27T08:38:00Z,Für das internationale Kernfusionsprojekt International Thermonuclear Experimental Reactor (ITER) zeichnet sich ein neuer Zeitplan ab. Auf dem jüngsten Treffen des ITER Council wurde über eine Reform… [+2691 chars]
"{'id': 'die-zeit', 'name': 'Die Zeit'}",ZEIT ONLINE: News -,Verkehr: Schlaue Ampeln sollen Verkehr in Ellwangen verbessern,Hier finden Sie Informationen zu dem Thema „Verkehr“. Lesen Sie jetzt „Schlaue Ampeln sollen Verkehr in Ellwangen verbessern“.,https://www.zeit.de/news/2024-06/27/schlaue-ampeln-sollen-verkehr-in-ellwangen-verbessern,https://img.zeit.de/news/2024-06/27/schlaue-ampeln-sollen-verkehr-in-ellwangen-verbessern-image-group/wide__1300x731,2024-06-27T15:36:30Z,"Das Land will durch Künstliche Intelligenz (KI) gesteuerte Ampeln in Ellwangen testen. Von Juli an werde der Verkehr per KI gesteuert, teilte das Verkehrsministerium am Donnerstag mit. Zum Einsatz ko… [+2371 chars]"
"{'id': None, 'name': 'Caschys Blog'}",caschy,Paramount sucht Streaming-Partner,"Paramount Global führt laut CNBC derzeit Gespräche mit anderen Unterhaltungsunternehmen, um seinen Streaming-Dienst Paramount+ mit einer bestehenden Plattform zu fusionieren. Paramount+ läuft wohl eher so mittel, da sucht man also schlagkräftige Partner, um d…",https://stadt-bremerhaven.de/paramount-sucht-streaming-partner/,https://stadt-bremerhaven.de/wp-content/uploads/2020/09/paramount.jpg,2024-07-02T06:30:37Z,"Paramount Global führt laut CNBC derzeit Gespräche mit anderen Unterhaltungsunternehmen, um seinen Streaming-Dienst Paramount+ mit einer bestehenden Plattform zu fusionieren. Paramount+ läuft wohl eh… [+1365 chars]"
"{'id': None, 'name': 'DIE WELT'}",Lena Karger,Das Existenzrecht Israels ist nicht verhandelbar – außer es gibt Ärger,"Die Fusion versteht sich als eine gelebte linke Utopie, in der sich alle lieb haben. Doch dann knickt die Festival-Leitung vor Boykott-Aufrufen von Hamas-Unterstützern ein – und es wird immer schlimmer.",https://www.welt.de/kultur/article252237878/Fusion-Festival-Existenzrecht-Israels-nun-doch-verhandelbar.html,https://img.welt.de/img/kultur/mobile252251408/6511355007-ci16x9-w1200/Fusion-Festival-feiert-25-jaehriges-Jubilaeum-6.jpg,2024-06-28T12:05:27Z,"Jedes Jahr versammelt sich in Mecklenburg-Vorpommern eine Parallelgesellschaft, um zu feiern. Ein Ferienkommunismus, in dem es möglichst wenig Regeln und möglichst viel Selbsterfahrung geben soll, wi… [+5805 chars]"
"{'id': None, 'name': 'heise online'}",Marie-Claire Koch,"Hinterland of Things: Vom ""Klemmen-Valley"", Startups und KI","Startups können die Wirtschaft retten, sind sich Teilnehmer der ""Hinterland of Things""-Konferenz sicher. Ein wichtiger Bereich dabei ist Künstliche Intelligenz.",https://www.heise.de/news/Hinterland-of-Things-Vom-Klemmen-Valley-Startups-und-KI-9762752.html,https://heise.cloudimg.io/bound/1200x1200/q85.png-lossy-85.webp-lossy-85.foil1/_www-heise-de_/imgs/18/4/6/1/3/6/4/0/JulianHukePhotography-_A9_9115-4d889679dbda0ee4.jpeg,2024-06-14T10:10:00Z,"Zwar sinkt das Bruttoinlandsprodukt derzeit, doch Startups können die Wirtschaft retten. Dessen ist sich Dominik Gross sicher, er ist Mitgründer und Geschäftsführer der Tech-Startups ausbildenden Fou… [+4131 chars]"
"{'id': None, 'name': 'tagesschau.de'}",tagesschau.de,Boeing holt Zulieferer Spirit zurück in Konzern,"Um die Qualitätsprobleme in den Griff zu bekommen, wird Boeing den Zulieferer Spirit AeroSystems übernehmen. Spirit war 2005 ausgelagert worden und war in die Kritik geraten, weil es fehlerhafte Teile geliefert haben soll.",https://www.tagesschau.de/wirtschaft/unternehmen/boeing-spirit-airbus-kauf-alaska-737-max-qualitaet-100.html,https://images.tagesschau.de/image/db850bc4-33e4-4bc0-ae14-77a87b0287f8/AAABkGzR828/AAABjwnlFvA/16x9-1280/boeing-max-108.jpg,2024-07-01T06:23:35Z,"Stand: 01.07.2024 08:23 Uhr
Um die Qualitätsprobleme in den Griff zu bekommen, wird Boeing den Zulieferer Spirit AeroSystems übernehmen. Spirit war 2005 ausgelagert worden und war in die Kritik gera… [+2629 chars]"
"{'id': None, 'name': 'tagesschau.de'}",tagesschau.de,Kabinett stoppt Verkauf von VW-Tochter an Chinesen,Der Volkswagen-Konzern darf sein Gasturbinen-Geschäft nicht nach China verkaufen. Das Wirtschaftsministerium hat sein Veto eingelegt. Hintergrund ist ein möglicher Einsatz der Technik in Kriegsschiffen.,https://www.tagesschau.de/wirtschaft/unternehmen/volkswagen-verkauf-tochter-gasturbinen-china-100.html,https://images.tagesschau.de/image/ce37040f-f446-4dc5-9362-25a46a25d4e3/AAABkHddJrg/AAABjwnlFvA/16x9-1280/vw-man-energy-solutions-100.jpg,2024-07-03T11:42:24Z,"Stand: 03.07.2024 13:42 Uhr
Der Volkswagen-Konzern darf sein Gasturbinen-Geschäft nicht nach China verkaufen. Das Wirtschaftsministerium hat sein Veto eingelegt. Hintergrund ist ein möglicher Einsat… [+2711 chars]"
"{'id': None, 'name': 'Kraftfuttermischwerk.de'}",Ronny,Playlist: Fusion Festival Sets 2024,"Ich war auch in diesem Jahr nicht in Lärz, was wieder total okay ist. Dennoch will ich wie in jedem Jahr wissen, was dort auf…Mehr lesen ->Playlist: Fusion Festival Sets 2024",https://www.kraftfuttermischwerk.de/blogg/playlist-fusion-festival-sets-2024/,https://www.kraftfuttermischwerk.de/blogg/wp-content/uploads2/2024/06/artworks-zMcFBsbyFaHp0yd4-yYnt4w-t500x500.jpg,2024-06-30T10:20:15Z,"Ich war auch in diesem Jahr nicht in Lärz, was wieder total okay ist. Dennoch will ich wie in jedem Jahr wissen, was dort auf all den Bühnen so gelaufen ist und packe deshalb alle Sets, die ich bei S… [+543 chars]"
"{'id': None, 'name': 'STERN.de'}",STERN.de,Mecklenburg-Vorpommern: Drogen-Check-Programm beim Fusion-Festival,"Ecstasy, Kokain, Speed - auf dem Fusion-Festival können Besucher ihre Drogen auf Reinheit testen lassen. Das Programm soll die Sicherheit erhöhen und lebensgefährliche Verunreinigungen aufdecken.",https://www.stern.de/panorama/mecklenburg-vorpommern--drogen-check-programm-beim-fusion-festival-34828540.html,https://image.stern.de/34828542/t/Hv/v1/w1440/r1.7778/-/25--urnnewsmldpacom2009010124062599527713v3w800h600l142t15r2190b1579jpeg---0656f962176935e3.jpg,2024-06-25T15:15:40Z,"Ecstasy, Kokain, Speed - auf dem Fusion-Festival können Besucher ihre Drogen auf Reinheit testen lassen. Das Programm soll die Sicherheit erhöhen und lebensgefährliche Verunreinigungen aufdecken.
Me… [+2337 chars]"
"{'id': None, 'name': '[Removed]'}",,[Removed],[Removed],https://removed.com,,1970-01-01T00:00:00Z,[Removed]
"{'id': 'focus', 'name': 'Focus'}",FOCUS online,Biblis - Altes Atomkrafwerk soll Strom der Zukunft liefern - doch es gibt einen Haken,"Das AKW Biblis ist eigentlich seit mehr als zehn Jahren vom deutschen Netz. Doch Betreiber RWE beabsichtigt nun, das Werk für die Nachfolgetechnologie der Kernkraft freizumachen: die Kernfusion. Zusammen mit einem Darmstädter Start-Up soll hier Forschung betr…",https://www.focus.de/earth/news/biblis-altes-akw-soll-strom-der-zukunft-liefern-doch-es-gibt-einen-haken_id_260107701.html,https://p6.focus.de/img/regional/hessen/id_260016185/das-abgeschaltete-akw-biblis-in-suedhessen-luftaufnahme-aus-einem-flugzeug-..jpg?im=Crop%3D%280%2C170%2C2048%2C1024%29%3BResize%3D%281200%2C627%29&impolicy=perceptual&quality=mediumHigh&hash=0a4586b888d14c4adefb69e440964fb50b18a727e6a1b9e6992c329a9a3b40bc,2024-07-04T10:19:15Z,"Das AKW Biblis ist eigentlich seit mehr als zehn Jahren vom deutschen Netz. Doch Betreiber RWE beabsichtigt nun, das Werk für die Nachfolgetechnologie der Kernkraft freizumachen: die Kernfusion. Zusa… [+4614 chars]"
"{'id': None, 'name': 'ifun.de › Apple-News seit 2001'}",Chris,Baden-Württemberg testet KI-Verkehrssteuerung,"Das in London bereits erfolgreich eingesetzte Verkehrssteuerungssystem Yutraffic Fusion wird jetzt erstmals auch in Deutschland eingesetzt. Allerdings handelt es sich hier noch um einen Testlauf. Zunächst auf ein halbes Jahr begrenzt, soll sich zeigen, ob die…",https://www.ifun.de/baden-wuerttemberg-testet-ki-verkehrssteuerung-235106/,https://images.ifun.de/wp-content/uploads/2024/06/verkehr-feature.jpg,2024-06-27T18:38:12Z,Das in London bereits erfolgreich eingesetzte Verkehrssteuerungssystem Yutraffic Fusion wird jetzt erstmals auch in Deutschland eingesetzt. Allerdings handelt es sich hier noch um einen Testlauf. Zun… [+2191 chars]
"{'id': None, 'name': 'STERN.de'}",STERN.de,Bankenhochzeit: Frankfurt und Aschaffenburg schmieden größte Volksbank,Für die Frankfurter Volksbank ist es die 22. Fusion seit 1990. Der Zusammenschluss mit der Raiffeisen-Volksbank Aschaffenburg ist aber ein ganz besonderer.,https://www.stern.de/gesellschaft/regional/bayern/bankenhochzeit--frankfurt-und-aschaffenburg-schmieden-groesste-volksbank-34832948.html,https://image.stern.de/34832950/t/nk/v1/w1440/r1.7778/-/27--urnnewsmldpacom2009010124062799548488v2w800h600l1000t664r3000b1997jpeg---d1716fb1b6e2d950.jpg,2024-06-27T03:34:42Z,"Für die Frankfurter Volksbank ist es die 22. Fusion seit 1990. Der Zusammenschluss mit der Raiffeisen-Volksbank Aschaffenburg ist aber ein ganz besonderer.
Deutschlands Volksbanken haben eine neue N… [+2108 chars]"
"{'id': None, 'name': 'tagesschau.de'}",tagesschau.de,Ex-RAF-Terroristin: Offenbar Überfall-Waffe in Klettes Wohnung gefunden,Zu den Ermittlungen um die Ex-RAF-Terroristen Klette und Garweg gibt es neue Details: Nach Spiegel-Informationen soll in Klettes Wohnung die Tatwaffe aus einem missglückten Überfall gefunden worden sein. Zudem wurde offenbar Garweg abgehört.,https://www.tagesschau.de/inland/klette-garweg-raf-100.html,https://images.tagesschau.de/image/8b1443e2-acf7-427a-bc5b-6528cadc0310/AAABkDqHZII/AAABjwnlFvA/16x9-1280/klette-wohnung-durchsuchung-100.jpg,2024-06-21T11:44:00Z,"Stand: 21.06.2024 13:44 Uhr
Zu den Ermittlungen um die Ex-RAF-Terroristen Klette und Garweg gibt es neue Details: Nach Spiegel-Informationen soll in Klettes Wohnung die Tatwaffe aus einem missglückt… [+3502 chars]"
"{'id': None, 'name': 'tagesschau.de'}",tagesschau.de,Marktbericht: Mit neuem Schwung ins zweite Börsenhalbjahr?,Zuletzt war die Rally am deutschen Aktienmarkt ins Stocken geraten - doch zu Beginn des neues Halbjahres an der Börse dürfte es zunächst auch mit dem DAX wieder klar bergauf gehen.,https://www.tagesschau.de/wirtschaft/finanzen/marktberichte/marktbericht-dax-kurse-frankreich-wahl-boerse-dow-oel-gold-euro-aktien-100.html,https://images.tagesschau.de/image/098248ee-3798-4683-93ce-cf30ed6c129b/AAABjnQ3ypo/AAABjwnlFvA/16x9-1280/boerse-346.jpg,2024-07-01T05:32:09Z,"Stand: 01.07.2024 07:32 Uhr
Zuletzt war die Rally am deutschen Aktienmarkt ins Stocken geraten - doch zu Beginn des neues Halbjahres an der Börse dürfte es zunächst auch mit dem DAX wieder klar berg… [+3640 chars]"
"{'id': None, 'name': 'N-tv.de'}",n-tv NACHRICHTEN,"Festival, Partys, Drogen: Freunde berichten von freiem Leben von RAF-Terrorist","Noch immer fehlt von den früheren RAF-Terroristen Staub und Garweg jede Spur. Auch die Festnahme ihrer Weggefährtin Klette brachte nicht den Durchbruch. Ein Bericht zeichnet nun das Leben von Garweg in den vergangenen Jahrzehnten nach. Sorgen, entdeckt zu wer…",https://www.n-tv.de/politik/Freunde-berichten-von-freiem-Leben-von-RAF-Terrorist-Burkhard-Garweg-article25033192.html,https://bilder4.n-tv.de/img/incoming/crop25033291/1111321805-cImg_16_9-w1200/454570828.jpg,2024-06-21T13:55:03Z,Noch immer fehlt von den früheren RAF-Terroristen Staub und Garweg jede Spur. Auch die Festnahme ihrer Weggefährtin Klette brachte nicht den Durchbruch. Ein Bericht zeichnet nun das Leben von Garweg … [+2665 chars]
"{'id': None, 'name': 'STERN.de'}",Nicole Simon,Festival: Geil oder giftig? Der Partydrogen-Test im Hightech-Labor,"Wer Partydrogen wie Ecstasy kauft, kann nie sicher sein, was wirklich in den Pillen steckt. Ein Notfallmediziner will das ändern und ist mit einem ganz besonderen Gerät zum Fusion-Festival gereist.",https://www.stern.de/panorama/wissen/der-partydrogen-test-im-hightech-labor--geil-oder-giftig---34830214.html,https://image.stern.de/34830828/t/tY/v6/w1440/r1.7778/-/partydrogen.jpg,2024-06-26T18:24:00Z,"Zu Tausenden strömen sie durch die Hitze vorbei an glitzernden Seen und blühenden Wiesen, auf denen Pferde grasen, durch Dörfer mit Namen, die auf ""itz"" oder ""ow"" enden. In langen Reihen kommen sie d… [+464 chars]"
