source,author,title,description,url,urlToImage,publishedAt,content
"{'id': None, 'name': 'Versicherungswirtschaft-heute.de'}",Michael Stanczyk,Zurich bedient sich bei AIG,"Die Zurich-Gruppe kauft das Reiseversicherungs- und Assistancegeschäft des New Yorker Versicherers. Der Bereich firmiert bislang unter der Marke AIG Travel. Die Schweizer legen für die Sparte, die derzeit auch bei der Allianz hoch im Kurs steht, 600 Millionen…",https://versicherungswirtschaft-heute.de/unternehmen-und-management/2024-06-27/zurich-bedient-sich-bei-aig/,https://versicherungswirtschaft-heute.de/wp-60d20-content/uploads/2022/08/Zurich-Zentrale-in-Zuerich_MV-1200x900.jpeg,2024-06-26T22:00:00Z,Zurich-Zentrale in Zurich. Quelle: mv.Die Zurich-Gruppe kauft das Reiseversicherungs- und Assistancegeschäft des New Yorker Versicherers. Der Bereich firmiert bislang unter der Marke AIG Travel. Die … [+1922 chars]
"{'id': None, 'name': 'Www.nzz.ch'}",Auswärtige Autoren (AA),GASTKOMMENTAR - Eine starke globale Bank als Pfeiler einer zukunftsfähigen Schweiz,"Nach Abschluss aller Untersuchungen gilt es, die richtigen Lehren aus dem Kollaps der Credit Suisse zu ziehen. Wenn wir ein wettbewerbsfähiges und nachhaltig profitables Bankensystem behalten wollen, brauchen wir solide und glaubwürdige Rahmenbedingungen.",https://www.nzz.ch/meinung/eine-starke-globale-bank-als-pfeiler-einer-zukunftsfaehigen-schweiz-ld.1836205,"https://img.nzz.ch/2023/08/31/1ae12110-d9da-46a2-b0c5-36df35989601.jpeg?width=1200&height=674&fit=bounds&quality=75&auto=webp&crop=4267,2400,x533,y30&wmark=nzz",2024-06-24T03:30:00Z,"Der UBS-Chef Sergio P. Ermotti bedauert, dass viele Kritiker das Bestehen einer grossen Bank in der Schweiz nur noch als Gefahr sehen.
Die Schweiz gehört zu den meistbewunderten Ländern. Wir sind di… [+9817 chars]"
"{'id': None, 'name': 'heise online'}",Dirk Knop,Juniper: Kritische Lücke erlaubt Angreifern Übernahme von Session Smart Router,"Juniper Networks liefert außerplanmäßige Updates gegen eine kritische Sicherheitslücke in Session Smart Router, -Conductor und WAN Assurance Router.",https://www.heise.de/news/Juniper-Kritische-Luecke-erlaubt-Angreifern-Uebernahme-von-Session-Smart-Router-9781931.html,https://heise.cloudimg.io/bound/1200x1200/q85.png-lossy-85.webp-lossy-85.foil1/_www-heise-de_/imgs/18/4/6/2/3/6/8/1/2024-04-10-Bing_Designer-Brennende_Appliances-2-2160px-e143670f0745ec3b.png,2024-06-28T07:04:00Z,"Juniper Networks warnt vor einer kritischen Sicherheitslücke in Session Smart Router, Session Smart Conductor und WAN Assurance Router. Sofern diese mit einem redundanten Peer eingesetzt werden, reiß… [+1423 chars]"
"{'id': None, 'name': 'heise online'}",Ulrich Schmitz,Interne Dokumente zeigen Probleme bei Amazon One Medical,"Nach der Übernahme von One Medical durch Amazon kommt es offenbar zu Leistungskürzungen und schlechterer Patientenversorgung, wie die Washington Post berichtet.",https://www.heise.de/news/Interne-Dokumente-zeigen-Probleme-bei-Amazon-One-Medical-9765244.html,https://heise.cloudimg.io/bound/1200x1200/q85.png-lossy-85.webp-lossy-85.foil1/_www-heise-de_/imgs/18/4/6/1/4/9/3/9/shutterstock_1855666987-9e48d9938a12710a.jpg,2024-06-16T16:12:00Z,"Seitdem der US-amerikanische Gesundheitsdienstleister One Medical die Vermittlung der Patienten in Callcenter verlagert hat, treten offenbar vermehrt Probleme auf. One Medical leitet ältere Patienten… [+1526 chars]"
"{'id': None, 'name': 'heise online'}",Martin Holland,Mit Werbung zur Profitabilität: BeReal wird für 500 Millionen Euro übernommen,"Die französische Social-Media-App BeReal hat eine treue, aber nicht mehr wachsende Nutzerschaft. Das soll sich nach der Übernahme durch Vodoo bald ändern.",https://www.heise.de/news/Mit-Werbung-zur-Profitabilitaet-BeReal-wird-fuer-500-Millionen-Euro-uebernommen-9758881.html,https://heise.cloudimg.io/bound/1200x1200/q85.png-lossy-85.webp-lossy-85.foil1/_www-heise-de_/imgs/18/4/6/1/1/5/9/3/shutterstock_2062352315-9d55ccb8dee4624e.jpg,2024-06-12T06:34:00Z,Ein französischer Entwickler von Mobilspielen übernimmt die ebenfalls aus Frankreich stammende Sozcal-Media-App BeReal für 500 Millionen Euro. Mit dem Schritt will das Spielestudio Vodoo die eigene S… [+1862 chars]
"{'id': None, 'name': 'Golem.de'}",Achim Sawall,Nokia: Durch Übernahme besser mit Huawei und Ciena konkurrieren,"Mit dem Kauf von Infinera will Nokia sich mit den Marktführern im Bereich optische Netzausrüstung messen. Die Übernahme kostet über zwei Milliarden US-Dollar. (Nokia, Wirtschaft)",https://www.golem.de/sonstiges/zustimmung/auswahl.html?from=https%3A%2F%2Fwww.golem.de%2Fnews%2Fnokia-durch-uebernahme-besser-mit-huawei-und-ciena-konkurrieren-2407-186614.html&referer=https%3A%2F%2Ft.co%2F8fd35b1f3b,,2024-07-01T16:46:02Z,"Besuchen Sie Golem.de wie gewohnt mit Werbung und Tracking,
 indem Sie der Nutzung aller Cookies zustimmen.
 Details zum Tracking finden Sie im Privacy Center.
Skript wurde nicht geladen. Informat… [+607 chars]"
"{'id': 'die-zeit', 'name': 'Die Zeit'}",ZEIT ONLINE: News -,Unternehmen: Keine Folgen für Festival in Wacken durch Übernahme,Hier finden Sie Informationen zu dem Thema „Unternehmen“. Lesen Sie jetzt „Keine Folgen für Festival in Wacken durch Übernahme“.,https://www.zeit.de/news/2024-06/24/keine-folgen-fuer-festival-in-wacken-durch-uebernahme,https://img.zeit.de/administratives/sharing/fallback-image/wide__1300x731,2024-06-24T15:22:05Z,Die mögliche Übernahme des Veranstalters des Heavy-Metal-Festivals im schleswig-holsteinischen Wacken hat nach Angaben der Festivalmacher aktuell keine Auswirkungen auf das Wacken Open Air (31. Juli … [+946 chars]
"{'id': None, 'name': 'heise online'}",Axel Kannenberg,"VMware macht weniger Umsatz unter Broadcom, dafür werden Kosten gedrückt","Broadcom kann dank KI-Nachfrage und VMware einen Umsatzsprung verbuchen. Allerdings liegt VMwares Erlös unter dem, was man früher unabhängig umgesetzt hat.",https://www.heise.de/news/VMware-macht-weniger-Umsatz-unter-Broadcom-dafuer-werden-Kosten-gedrueckt-9761885.html,https://heise.cloudimg.io/bound/1200x1200/q85.png-lossy-85.webp-lossy-85.foil1/_www-heise-de_/imgs/18/4/6/1/3/1/8/3/shutterstock_1350667379-e9fdbea2ab0978ef.jpg,2024-06-13T11:39:00Z,"Software- und Halbleiteranbieter Broadcom sieht sich in seinem zweiten Quartal vom KI-Boom sowie der VMware-Übernahme beflügelt. Allein die Nachfrage nach KI-Produkten des Unternehmens habe für 3,1 M… [+3413 chars]"
"{'id': None, 'name': 'Faz.net'}",Jonas Jansen,Milliardenschwere Übernahme: Kunststoffkonzern Covestro öffnet Adnoc die Bücher,Nach monatelangem Werben verhandelt der Kunststoffkonzern nun konkret über eine Übernahme durch den arabischen Ölkonzern Adnoc. Dafür gibt es einige Bedingungen – unter anderem den Preis.,https://www.faz.net/aktuell/wirtschaft/unternehmen/milliardenschwere-uebernahme-kunststoffkonzern-covestro-oeffnet-adnoc-die-buecher-19810984.html,https://media0.faz.net/ppmedia/aktuell/1199186148/1.9810988/facebook_teaser/uebernahmeziel-ein-mitarbeiter.jpg,2024-06-24T13:27:35Z,"Wir haben in unseren Gesprächen mit Adnoc gute Fortschritte erzielt, ließ sich Markus Steilemann, der Vorstandsvorsitzende von Covestro, zitieren: Daher haben wir beschlossen, in konkrete Transaktion… [+4152 chars]"
"{'id': None, 'name': 'Golem.de'}",Thomas Hafen,Broadcom-Übernahme von VMware: Die Stimmung ist besser als der Ruf,"Nach der Übernahme durch Broadcom kommt VMWare nicht aus den Negativschlagzeilen. Bei aller Kritik ist die Stimmung unter den Anwendern jedoch besser als gedacht. Ein Bericht von Thomas Hafen (VMware, Virtualisierung)",https://www.golem.de/sonstiges/zustimmung/auswahl.html?from=https%3A%2F%2Fwww.golem.de%2Fnews%2Fbroadcom-uebernahme-von-vmware-die-stimmung-ist-besser-als-der-ruf-2406-186036.html&referer=https%3A%2F%2Ft.co%2F1c3967580b,,2024-06-15T07:00:01Z,"Besuchen Sie Golem.de wie gewohnt mit Werbung und Tracking,
 indem Sie der Nutzung aller Cookies zustimmen.
 Details zum Tracking finden Sie im Privacy Center.
Skript wurde nicht geladen. Informat… [+607 chars]"
"{'id': None, 'name': 'Faz.net'}","Sven Astheimer, Timo Kotowski","Lufthansa-Chef Spohr: „Wir brauchen Airlines, die mit Amerika und China mithalten können“",Die Hängepartie ist vorbei: Die Lufthansa darf den italienischen Rivalen ITA kaufen. Für Konzernchef Carsten Spohr rückt schon die nächste Übernahme in den Fokus. Ein Interview.,https://www.faz.net/aktuell/wirtschaft/unternehmen/lufthansa-chef-spohr-zu-kauf-von-ita-lufthansa-muss-internationaler-werden-19829530.html,https://media1.faz.net/ppmedia/aktuell/2558986923/1.9829573/facebook_teaser/lufthansa-chef-carsten-spohr.jpg,2024-07-03T11:56:12Z,"Die Deutsche Lufthansa kann jetzt wachsen. Was hat aber der Reisende davon, dass es mit ITA eine eigenständige Airline weniger gibt? 
Kunden in Italien bekommen die Möglichkeit, langfristig mit eine… [+10347 chars]"
"{'id': None, 'name': 'heise online'}",Matthias Parbel,DevSecOps und MLOps vereint: JFrog übernimmt ML-Plattform Qwak​,Mit der Akquise von Qwak will JFrog die Lücke zwischen MLOps und DevSecOps schließen. DevOps-Teams sollen KI-Anwendungen schneller entwickeln.​,https://www.heise.de/news/DevSecOps-und-MLOps-vereint-JFrog-uebernimmt-ML-Plattform-Qwak-9779567.html,https://heise.cloudimg.io/bound/1200x1200/q85.png-lossy-85.webp-lossy-85.foil1/_www-heise-de_/imgs/18/4/6/2/2/4/4/9/Frosch-auf-Ente-auf-Teich_1280x1024-d872a386a8c0b731.png,2024-06-26T15:03:00Z,"JFrog, Anbieter der gleichnamigen Software-Supply-Chain-Plattform, hat die Übernahme von Qwak AI vollzogen. Die vor rund vier Jahren geründete Firma Qwak ist darauf spezialisiert, Data Scientists bei… [+2522 chars]"
"{'id': 'die-zeit', 'name': 'Die Zeit'}",ZEIT ONLINE: Wirtschaft - Christopher Trinks,Leverkusener Chemieproduzent: Arabischer Ölkonzern Adnoc plant Milliardenübernahme von Covestro,Seit Monaten verhandelt der staatliche Ölproduzent Adnoc über einen Kauf des Leverkusener Kunststoffherstellers Covestro. Nun hat der Konzern sein Angebot erhöht.,https://www.zeit.de/wirtschaft/2024-06/adnoc-bietet-milliarden-fuer-covestro,https://img.zeit.de/wirtschaft/unternehmen/2024-06/adnoc-bietet-milliarden-fuer-covestro-bild/wide__1300x731,2024-06-24T10:49:50Z,"Der arabische Ölkonzern Adnoc intensiviert die Verhandlungen über eine mögliche Übernahme des Kunststoffproduzenten Covestro. Wie das Unternehmen mit Sitz in Leverkusen mitteilte, hat Adnoc jetzt ein… [+1618 chars]"
"{'id': None, 'name': 'tagesschau.de'}",Dietrich Karl Mäurer,"Kommentar zum AfD-Parteitag: Chance verpasst, aus Fehlern zu lernen","Auf ihrem Parteitag übte sich die AfD in Normalität. Doch zur Übernahme von Regierungsverantwortung hat sie sich nicht qualifiziert, meint Dietrich Karl Mäurer. Fehler wurden nicht aufgearbeitet, Kritik ausgeblendet, echte Lösungen fehlten.",https://www.tagesschau.de/kommentar/kommentar-afd-parteitag-maeurer-100.html,https://images.tagesschau.de/image/a682abc0-0ac3-4949-8b87-23febf2458bb/AAABkGm3mAA/AAABjwnlFvA/16x9-1280/afd-788.jpg,2024-06-30T15:15:58Z,"Stand: 30.06.2024 17:15 Uhr
Auf ihrem Parteitag übte sich die AfD in Normalität, doch zur Übernahme von Regierungsverantwortung hat sie sich nicht qualifiziert. Fehler wurden nicht aufgearbeitet, Kr… [+2407 chars]"
"{'id': None, 'name': 'tagesschau.de'}",tagesschau.de,Slowakisches Parlament stimmt für Rundfunkumbau,Das slowakische Parlament hat für den Umbau der öffentlich-rechtlichen Medien im Land gestimmt. Die Sendeanstalt RTVS soll nun aufgelöst werden - und ein Ersatz folgen. Kritiker sehen darin eine Übernahme durch die Regierung.,https://www.tagesschau.de/ausland/europa/slowakei-aufloesung-sendeanstalt-100.html,https://images.tagesschau.de/image/54d94ca6-b6c9-4186-9824-a13f01860915/AAABkDe6H_Q/AAABjwnlFvA/16x9-1280/slowakischer-rundfunk-gebaeude-100.jpg,2024-06-20T23:13:42Z,"Stand: 21.06.2024 01:13 Uhr
Das slowakische Parlament hat für den Umbau der öffentlich-rechtlichen Medien im Land gestimmt. Die Sendeanstalt RTVS soll nun aufgelöst werden - und ein Ersatz folgen. K… [+2427 chars]"
"{'id': 'die-zeit', 'name': 'Die Zeit'}",ZEIT ONLINE: Unternehmen - Mathis Gann,US-Flugzeughersteller: Boeing übernimmt Zulieferer Spirit Aerosystems,"Einst spaltete Boeing eine Konzernsparte ab, um Geld zu sparen. Doch nach Kritik an mangelnder Qualität verleibt sich der US-Konzern den Zulieferer Spirit nun wieder ein.",https://www.zeit.de/wirtschaft/unternehmen/2024-07/boeing-uebernahme-zulieferer-spirit-aerosystems-737-max,https://img.zeit.de/administratives/sharing/fallback-image/wide__1300x731,2024-07-01T05:57:14Z,"Der US-Flugzeughersteller Boeing holt den wichtigen Zulieferer Spirit Aerosystems wieder zurück unter das Konzerndach. Für den Aktiendeal zahlt Boeing rund 4,7 Milliarden US-Dollar. Einschließlich de… [+2202 chars]"
"{'id': None, 'name': 'heise online'}",Moritz Förster,Amazon AWS gegen Broadcom: Kampf um VMware spitzt sich zu,"Während Google und Microsoft nun Partner des neuen VMware sind, kann Broadcom den Cloud-Riesen AWS bislang nicht gewinnen – mit jetzt drastischen Auswirkungen.",https://www.heise.de/news/Amazon-AWS-gegen-Broadcom-Kampf-um-VMware-spitzt-sich-zu-9763503.html,https://heise.cloudimg.io/bound/1200x1200/q85.png-lossy-85.webp-lossy-85.foil1/_www-heise-de_/imgs/18/4/6/1/4/0/2/9/shutterstock_1782212120-3c1114f9572826e4.jpg,2024-06-14T10:07:00Z,"Machtprobe zwischen Broadcom und Amazon: Die VMware Cloud ist jetzt nur noch im Abonnement und ausschließlich von Resellern oder Broadcom selbst erhältlich. Das flexible Modell, bei dem Nutzer Kapazi… [+2009 chars]"
"{'id': None, 'name': 'heise online'}",Benjamin Pfister,"Umsatz mit Campus-Switches bricht ein, aber Arista expandiert",Der Umsatz mit Campus-Ethernet-Switches sinkt im ersten Quartal 2024 auf ein Zwei-Jahres-Tief. Lediglich Arista und auch Ubiquiti stemmen sich gegen den Trend.,https://www.heise.de/news/Umsatz-mit-Campus-Switches-bricht-ein-aber-Arista-expandiert-9781446.html,https://heise.cloudimg.io/bound/1200x1200/q85.png-lossy-85.webp-lossy-85.foil1/_www-heise-de_/imgs/18/4/6/2/3/4/2/9/shutterstock_75493267-ba4878c90d810c70.jpg,2024-06-28T07:12:00Z,"Der weltweite Umsatz mit Campus-Ethernet-Switches im ersten Quartal 2024 ist Vorjahresvergleich um 23 Prozent eingebrochen, wie aus einer Marktanalyse der DellOro Group hervorgeht. Dies markiert das … [+1726 chars]"
"{'id': 'die-zeit', 'name': 'Die Zeit'}",ZEIT ONLINE: News -,Politik: Kretschmer dringt auf finanzielle Entlastung in der Pflege,Hier finden Sie Informationen zu dem Thema „Politik“. Lesen Sie jetzt „Kretschmer dringt auf finanzielle Entlastung in der Pflege“.,https://www.zeit.de/news/2024-06/18/kretschmer-dringt-auf-finanzielle-entlastung-in-der-pflege,https://img.zeit.de/news/2024-06/18/kretschmer-dringt-auf-finanzielle-entlastung-in-der-pflege-image-group/wide__1300x731,2024-06-18T05:03:34Z,"Vor dem Treffen der Ost-Regierungschefs hat Sachsens Ministerpräsident Michael Kretschmer (CDU) finanzielle Entlastungen für die Bürger in der Pflege gefordert. ""Besonders in den ostdeutschen Ländern… [+2045 chars]"
"{'id': None, 'name': 'Faz.net'}",Reuters,Österreichs Bawag kauft deutsches Privatkundengeschäft von Barclays,Die österreichische Bank kauft das deutsche Privatkundengeschäft der britischen Großbank. Mit dem Verkauf will Barclays seine Präsenz in verschiedenen Geschäftsbereichen und Regionen straffen.,https://www.faz.net/aktuell/finanzen/finanzmarkt/bawag-kauft-deutsches-privatkundengeschaeft-von-barclays-19833348.html,https://media0.faz.net/ppmedia/aktuell/1933313854/1.9833382/facebook_teaser/eine-barclays-filiale-in.jpg,2024-07-04T08:39:34Z,"Die Assets der Barclays Consumer Bank Europe belaufen sich nach Angaben der Bawag per Ende März auf rund 4,7 Milliarden Euro und bestehen vor allem aus Karten- und Kreditforderungen. Die Übernahme, d… [+1096 chars]"
"{'id': None, 'name': 'heise online'}",Frank Schräer,"Google stellt Fitbits Web-Dashboard ein, reduziert Fitness-Tracker auf die App","Fitbits Dashboard zeigt im Web übersichtlich Fitness-Daten und -Grafiken. Im Juli wird es eingestellt. Google verweist auf die App, doch dort fehlen Funktionen.",https://www.heise.de/news/Google-stellt-Fitbits-Web-Dashboard-ein-reduziert-Fitness-Tracker-auf-die-App-9760906.html,https://heise.cloudimg.io/bound/1200x1200/q85.png-lossy-85.webp-lossy-85.foil1/_www-heise-de_/imgs/18/4/6/1/2/6/6/4/shutterstock_1465994576-cc66c11552678f8f.jpg,2024-06-13T02:33:00Z,"Google scheint Fitbit und die diversen Funktionalitäten dieses Fitness-Trackers schrittweise abzuwickeln. Seit April sind im bisher eigenständigen Fitbit-Webshop keine Einkäufe mehr möglich, man wird… [+2601 chars]"
"{'id': None, 'name': 'heise online'}",Frank Schräer,Meta Platforms bindet Threads stärker in das Fediverse ein,"Meta demonstriert das Fediverse anhand von Threads. Reaktionen und Antworten auf verknüpfte Threads-Beiträge sind auch bei Mastodon, Instagram und Co. sichtbar.",https://www.heise.de/news/Meta-Platforms-bindet-Threads-staerker-in-das-Fediverse-ein-9778127.html,https://heise.cloudimg.io/bound/1200x1200/q85.png-lossy-85.webp-lossy-85.foil1/_www-heise-de_/imgs/18/4/6/2/1/6/9/9/shutterstock_2330405447-e2d06e55f226a480.jpg,2024-06-26T02:34:00Z,"Meta Platforms macht einen weiteren Schritt in der Entwicklung des sogenannten Fediverse, dem Netzwerk voneinander unabhängiger Sozialer Netze. Ab sofort können Nutzer des Kurznachrichtendienstes Thr… [+2548 chars]"
"{'id': None, 'name': 'heise online'}",Eva-Maria Weiß,Monopol: EU hat weitere Fragen an Microsoft und OpenAI sowie Google und Samsung,"Wettbewerbskommissarin Margrethe Vestager holt weitere Stellungnahmen zu den Deals und Plänen von Big Tech ein. Sie meint, dass wir mit Monopolen leben.",https://www.heise.de/news/Monopol-EU-hat-weitere-Fragen-an-Microsoft-und-OpenAI-sowie-Google-und-Samsung-9784186.html,https://heise.cloudimg.io/bound/1200x1200/q85.png-lossy-85.webp-lossy-85.foil1/_www-heise-de_/imgs/18/4/6/2/4/8/5/9/shutterstock_2253502269-6da9dc9b2cee4b90.jpg,2024-07-01T06:52:00Z,"Die EU-Kommission hat erste Fragen an Microsoft und OpenAI zu den Bedingungen der Zusammenarbeit geschickt. Es geht um die Frage nach möglichen Verstößen nach dem Wettbewerbsrecht, konkret, ob der De… [+3048 chars]"
"{'id': None, 'name': 'heise online'}",André Kramer,Figma: Screendesigner und Entwickler sollen enger zusammenarbeiten,Figma hat ein Werkzeug für KI-generierte Designs angekündigt. Mit den Dev-Tools sollen Designer und Softwareentwickler Code und Layout besser kommunizieren.,https://www.heise.de/news/Figma-Screendesigner-und-Entwickler-sollen-enger-zusammenarbeiten-9775509.html,https://heise.cloudimg.io/bound/1200x1200/q85.png-lossy-85.webp-lossy-85.foil1/_www-heise-de_/imgs/18/4/6/2/0/3/1/6/_External__Figma_AI-963128afedaf05a7.png,2024-06-26T16:15:00Z,"Inhaltsverzeichnis
Der Entwickler des Programms Figma hat auf seiner jährlichen Konferenz Config ein Werkzeug für KI-generierte Designs angekündigt. Mit Figma entstehen Webseiten und grafische Benut… [+2893 chars]"
"{'id': 'die-zeit', 'name': 'Die Zeit'}",ZEIT ONLINE: News -,Regiomed: Hoffnung auf baldige Entscheidung für Thüringer Häuser,Hier finden Sie Informationen zu dem Thema „Regiomed“. Lesen Sie jetzt „Hoffnung auf baldige Entscheidung für Thüringer Häuser“.,https://www.zeit.de/news/2024-06/25/hoffnung-auf-baldige-entscheidung-fuer-thueringer-haeuser,https://img.zeit.de/news/2024-06/25/hoffnung-auf-baldige-entscheidung-fuer-thueringer-haeuser-image-group/wide__1300x731,2024-06-25T09:23:54Z,"Im Insolvenzverfahren für die kommunale Klinikgruppe Regiomed könnte im dritten Quartal feststehen, in welche Richtung es für die Thüringer Krankenhausstandorte geht. «Wir warten derzeit auf wichtige… [+2649 chars]"
"{'id': 'die-zeit', 'name': 'Die Zeit'}",ZEIT ONLINE: News -,Energie: Verkauf von Tennet-Stromnetz an Bund gescheitert,Hier finden Sie Informationen zu dem Thema „Energie“. Lesen Sie jetzt „Verkauf von Tennet-Stromnetz an Bund gescheitert“.,https://www.zeit.de/news/2024-06/20/verkauf-von-tennet-stromnetz-an-bund-gescheitert,https://img.zeit.de/news/2024-06/20/verkauf-von-tennet-stromnetz-an-bund-gescheitert-image-group/wide__1300x731,2024-06-20T08:16:04Z,"Die Verhandlungen zwischen dem Bund und dem niederländischen Netzbetreiber Tennet über einen Verkauf des deutschen Übertragungsnetzes sind nach Unternehmensangaben gescheitert. 
Tennet teilte mit, d… [+958 chars]"
"{'id': 'die-zeit', 'name': 'Die Zeit'}",ZEIT ONLINE: News -,Tourismus: FTI storniert alle Reisen,Hier finden Sie Informationen zu dem Thema „Tourismus“. Lesen Sie jetzt „FTI storniert alle Reisen“.,https://www.zeit.de/news/2024-06/14/fti-storniert-alle-reisen,https://img.zeit.de/news/2024-06/14/fti-storniert-alle-reisen-image-group/wide__1300x731,2024-06-14T16:01:16Z,"Der Reisekonzern FTI Touristik hat jetzt alle gebuchten Reisen gestrichen. Der vorläufige Insolvenzverwalter Axel Bierbach teilte nach einem Beschluss des Gläubigerausschusses am Freitag mit, auch sä… [+2482 chars]"
"{'id': None, 'name': 'Faz.net'}",Reuters,Österreichs Bawag kauft deutsches Privatkundengeschäft von Barclays,Die österreichische Bank kauft das deutsche Privatkundengeschäft der britischen Großbank. Mit dem Verkauf will Barclays seine Präsenz in verschiedenen Geschäftsbereichen und Regionen straffen.,https://www.faz.net/aktuell/finanzen/finanzmarkt/oesterreichs-bawag-kauft-deutsches-privatkundengeschaeft-von-barclays-19833348.html,https://media0.faz.net/ppmedia/aktuell/1933313854/1.9833382/facebook_teaser/eine-barclays-filiale-in.jpg,2024-07-04T08:39:34Z,"Mit dem Zukauf will die Bank ihre Präsenz in den Kernmärkten Österreich, Deutschland, Schweiz und den Niederlanden ausbauen, teilte das Institut am Donnerstag mit. Der Verkauf erfolgt laut Barclays z… [+1647 chars]"
"{'id': 'focus', 'name': 'Focus'}",FOCUS online,"Mega-Kursplus zum Handelsstart - Porsche will Vartas E-Auto-Batteriegeschäft übernehmen, Aktie lädt sich voll auf",Varta in ernsten Verhandlungen: Porsche flirtet mit der Übernahme der Elektroautobatterien. Die Varta-Aktie lädt sich wieder auf.,https://www.focus.de/finanzen/boerse/mega-kursplus-zum-handelsstart-porsche-will-vartas-e-auto-batteriegeschaeft-uebernehmen-aktie-laedt-sich-voll-auf_id_260111304.html,https://p6.focus.de/img/fotos/id_260111311/varta-ag-82663603.jpg?im=Crop%3D%280%2C288%2C3464%2C1732%29%3BResize%3D%281200%2C627%29&impolicy=perceptual&quality=mediumHigh&hash=4e4ce6aeec53c381682b0cc7633e788a87f1412219d0128f8c83aef953b0870e,2024-07-05T08:55:36Z,Varta in ernsten Verhandlungen: Porsche flirtet mit der Übernahme der Elektroautobatterien. Die Varta-Aktie lädt sich wieder auf.Der Sportwagenbauer Porsche will dem angeschlagenen Batteriekonzern Va… [+3805 chars]
"{'id': None, 'name': 'heise online'}",Stefan Krempl,Registermodernisierung: Bundesrat macht Weg frei für Datenschutzcockpit​,Das Cockpit soll für mehr Transparenz beim behördlichen Datenaustausch sorgen. Auch die Länder befürworten die Zuständigkeit des Bundesverwaltungsamts.,https://www.heise.de/news/Registermodernisierung-Bundesrat-macht-Weg-frei-fuer-das-Datenschutzcockpit-9791815.html,https://heise.cloudimg.io/bound/1200x1200/q85.png-lossy-85.webp-lossy-85.foil1/_www-heise-de_/imgs/18/4/6/2/8/8/7/8/shutterstock_1175191651-d37298a21574e486.jpg,2024-07-06T12:04:00Z,Öffentlichen Stellen und Behörden tauschen nach den aktuellen Plänen des Onlinezugangsgesetzes (OZG) zukünftig Daten unter Verwendung der Identifikationsnummer (IDNr) aus. Dadurch sollen Betroffene b… [+2876 chars]
"{'id': None, 'name': 'heise online'}",Frank Schräer,Threads zählt nach einem Jahr mehr als 175 Millionen monatlich aktive Nutzer,"Rund ein Jahr nach dem Start der Twitter-Alternative von Meta Platforms wächst Threads weiter, bloß nicht mehr so rapide wie zu Beginn. Mark Zuckerberg freuts.",https://www.heise.de/news/Threads-zaehlt-nach-einem-Jahr-mehr-als-175-Millionen-monatlich-aktive-Nutzer-9788991.html,https://heise.cloudimg.io/bound/1200x1200/q85.png-lossy-85.webp-lossy-85.foil1/_www-heise-de_/imgs/18/4/6/2/7/4/0/5/shutterstock_1098814631-99134bc933684f76.jpg,2024-07-04T02:35:00Z,"Vor ziemlich genau einem Jahr hat Meta Platforms mit Threads die eigene Twitter-Alternative eingeführt. Jetzt erklärt Meta-Chef Mark Zuckerberg, dass der Kurznachrichtendienst mittlerweile 175 Millio… [+2637 chars]"
"{'id': None, 'name': 'Faz.net'}",Thomas Gutschker,EU-Beitrittsgespräche: Beginn eines langen Weges für die Ukraine und Moldau,Mit einer Regierungskonferenz beginnen die Verhandlungen über die Aufnahme der Ukraine und Moldaus in die EU. Doch viel zu verhandeln gibt es gar nicht.,https://www.faz.net/aktuell/politik/ausland/eu-beitrittsgespraeche-mit-ukraine-und-moldau-beginn-eines-langen-weges-19813422.html,https://media1.faz.net/ppmedia/aktuell/politik/1547908989/1.9813439/facebook_teaser/wolodymyr-selenskyj-spricht.jpg,2024-06-25T12:54:56Z,"Bei beiden Konferenzen stellten die Mitgliedstaaten den beiden Kandidaten ihre Leitlinien und Grundsätze vor, die im Verhandlungsmandat niedergelegt sind. Auf jeden Fall müssen sie das gesamte europä… [+2240 chars]"
