source,author,title,description,url,urlToImage,publishedAt,content
"{'id': None, 'name': 'N-tv.de'}",n-tv NACHRICHTEN,"6,7 Millionen Papiere: Telekom stockt bei T-Mobile US auf",Die US-Tochter T-Mobile ist die Ertragsperle im Telekom-Konzern. Die Mutter schließt nun eine Kaufoption mit der Softbank ab und baut ihren Anteil aus. Dafür nehmen den Bonner einen hohen dreistelligen Millionenbetrag in die Hand.,https://www.n-tv.de/wirtschaft/Telekom-stockt-bei-T-Mobile-US-auf-article25003194.html,https://bilder1.n-tv.de/img/incoming/crop25003204/4511327270-cImg_16_9-w1200/457181134.jpg,2024-06-10T09:27:14Z,Die US-Tochter T-Mobile ist die Ertragsperle im Telekom-Konzern. Die Mutter schließt nun eine Kaufoption mit der Softbank ab und baut ihren Anteil aus. Dafür nehmen den Bonner einen hohen dreistellig… [+1426 chars]
"{'id': None, 'name': 'STERN.de'}",STERN.de,Bankenhochzeit: Größte Volksbank: Frankfurt und Aschaffenburg fusionieren,Für die Frankfurter Volksbank ist es die 22. Fusion seit 1990. Der Zusammenschluss mit der Raiffeisen-Volksbank Aschaffenburg ist aber ein ganz besonderer.,https://www.stern.de/wirtschaft/news/bankenhochzeit--groesste-volksbank--frankfurt-und-aschaffenburg-fusionieren-34832972.html,https://image.stern.de/34832974/t/wc/v1/w1440/r1.7778/-/27--urnnewsmldpacom2009010124062799548503v2w800h600l232t208r3424b2209jpeg---ce7197c3be10034d.jpg,2024-06-27T03:39:56Z,"Für die Frankfurter Volksbank ist es die 22. Fusion seit 1990. Der Zusammenschluss mit der Raiffeisen-Volksbank Aschaffenburg ist aber ein ganz besonderer.
Deutschlands Volksbanken haben eine neue N… [+1742 chars]"
"{'id': None, 'name': 'Süddeutsche Zeitung'}",Süddeutsche Zeitung,Sicherheitspolitik: Habeck stoppt Verkauf von VW-Tochter nach China,"Volkswagen wollte das Gasturbinen-Geschäft von MAN Energy Solutions an eine Firma geben, die auch für die chinesische Marine arbeitet. Techniken wie diese müssten geschützt werden, sagt der Wirtschaftsminister – die Regierung hat den Deal untersagt.",https://www.sueddeutsche.de/wirtschaft/vw-gasturbinen-china-bundesregierung-verbot-lux.TAiM9MyZWowv6mMeFwsT7Y,https://www.sueddeutsche.de/2024/07/03/d4e6640c-6e3e-480f-b936-953da7813c07.jpeg?q=60&fm=webp&width=1200&rect=0%2C0%2C3281%2C1845,2024-07-03T13:24:30Z,"GHGT gehört zum Werftenkonzern China State Shipbuilding Corp (CSSC), der auch Schiffe für die chinesische Marine baut. MAN Energy Solutions produziert und wartet Gasturbinen mit derzeit 100 Mitarbeit… [+2007 chars]"
"{'id': 'der-tagesspiegel', 'name': 'Der Tagesspiegel'}",Nicholas Potter,Fusion Festival im Schatten des Gaza-Krieges: „Stop Genocide“ wird mit „Stop Hamas“ übersprüht,Vor Festivalbeginn sorgte die Fusion aufgrund ihrer widersprüchlichen Position zum Nahostkonflikt für Kritik. Am Ende haben in Lärz viele Mitarbeitende und Gäste ihre Antisemitismuskritik zum Ausdruck gebracht. Ein Besuch.,https://www.tagesspiegel.de/kultur/fusion-festival-im-schatten-des-gaza-krieges-stop-genocide-wird-mit-stop-hamas-uberspruht-11929769.html,https://www.tagesspiegel.de/images/fusion-festival-feiert-25-jahriges-jubilaum1/alternates/BASE_16_9_W1400/fusion-festival-feiert-25-jaehriges-jubilaeum.jpeg,2024-06-30T13:58:47Z,"Samstag in Lärz: Die Sonne knallt, die Bässe wummern. Barfüßige Hippies tanzen neben sportlichen Antifa-Kids, allerlei Substanzen sind im Spiel. Für einen Moment könnte man fast vergessen, dass die F… [+254 chars]"
"{'id': None, 'name': 'STERN.de'}",STERN.de,Max: Das muss man über den Streamingdienst wissen,Zahlreiche Videostreamingdienste haben sich auf dem deutschen Markt etabliert. Mit Max kommt ein weiterer hinzu.,https://www.stern.de/kultur/max--das-muss-man-ueber-den-streamingdienst-wissen-34809896.html,https://image.stern.de/34809900/t/-j/v1/w1440/r1.7778/-/18--das-muss-man-ueber-den-streamingdienst-wissen---16-9---spoton-article-1068769.jpg,2024-06-18T18:01:00Z,"Zahlreiche Videostreamingdienste haben sich auf dem deutschen Markt etabliert. Mit Max kommt ein weiterer hinzu.
Die Auswahl der Dienste, bei denen Abonnentinnen und Abonnenten in Deutschland Filme … [+3802 chars]"
"{'id': 't3n', 'name': 'T3n'}",,"Zwischen Wissenschaft, Technologie und Kreativität: Wie L’Oréal die Beauty-Tech-Branche revolutioniert","Die Tech-Welt ist schnelllebig – und auch andere Branchen werden ständig durch Technologie verändert. Die Beauty-Industrie ist da keine Ausnahme. Entdecke, wie die L’Oréal Gruppe dem Zahn der Zeit immer ein Stück voraus ist und wie sie mit ihren Innovationen …",https://t3n.de/news/wissenschaft-technologie-kreativitaet-loreal-beauty-tech-1630371/,https://t3n.de/news/wp-content/uploads/2024/06/LOREAL_CREAITECH_Credit-LOreal-1200.jpg,2024-06-17T11:45:31Z,"Zwischen Wissenschaft, Technologie und Kreativität: Wie LOréal die Beauty-Tech-Branche revolutioniert
Die Tech-Welt ist schnelllebig und auch andere Branchen werden ständig durch Technologie verände… [+5353 chars]"
"{'id': None, 'name': 'Designtagebuch.de'}",Achim Schaffrinna,Verizon vollzieht Brand-Refresh,"Der US-amerikanische Telekommunikationskonzern Verizon hat ein Brand-Refresh vollzogen. Die Aktualisierung des Markendesigns erfolgt in Zusammenhang mit der Einführung neuer Services und Leistungen (myHome, Verizon Access, Verizon Business Complete, u.a.).",https://www.designtagebuch.de/verizon-vollzieht-brand-refresh/,https://www.designtagebuch.de/wp-content/uploads/mediathek//2024/06/verizon-logo.jpg,2024-07-01T08:00:09Z,Der US-amerikanische Telekommunikationskonzern Verizon hat ein Brand-Refresh vollzogen. Die Aktualisierung des Markendesigns erfolgt in Zusammenhang mit der Einführung neuer Services und Leistungen (… [+4183 chars]
"{'id': None, 'name': 'Diepresse.com'}",Die Presse,Boeing übernimmt Zulieferer Spirit,Der US-Flugzeugbauer will seinen Zulieferer Spirit in einem milliardenschweren Aktiendeal übernehmen.,https://www.diepresse.com/18621350/boeing-uebernimmt-zulieferer-spirit,https://img.diepresse.com/public/incoming/yf8itv-SPIRIT-AEROSYSTM-RESULTS/alternates/DPR_SOCIAL_NACHRICHTEN/SPIRIT%20AEROSYSTM-RESULTS,2024-07-01T06:46:47Z,"Der US-Flugzeugbauer will seinen Zulieferer Spirit in einem milliardenschweren Aktiendeal übernehmen.
Der US-Flugzeugbauer Boeing will seinen angeschlagenen Zulieferer Spirit AeroSystems in einem ru… [+934 chars]"
"{'id': None, 'name': 'Www.nzz.ch'}",Fabian Schäfer (fab),Eklat bei den Krankenkassen: «Das permanente Hickhack war manchmal fast schon peinlich»,"Eine der treibenden Kräfte hinter dem Coup gegen die bisherigen Krankenkassenverbände ist der Chef der KPT, Thomas Harnischberg. Unter den «internen Fehden» habe das Ansehen der Branche gelitten, sagt er. Und trotz SVP-Hintergrund ist er des Lobes voll für di…",https://www.nzz.ch/schweiz/eklat-bei-den-krankenkassen-das-permanente-hickhack-war-manchmal-fast-schon-peinlich-ld.1836005,"https://img.nzz.ch/2024/06/20/bea4c584-e797-4ddd-8f91-4f46cb5bbd48.jpeg?width=1200&height=674&fit=bounds&quality=75&auto=webp&crop=8082,4546,x0,y422&wmark=nzz",2024-06-20T12:00:00Z,"«Der Streit um den ambulanten Tarif war der Tropfen, der das Fass zum Überlaufen brachte»: Thomas Harnischberg, CEO der Krankenkasse KPT.
Herr Harnischberg, es gibt bereits zwei Krankenkassenverbänd… [+8371 chars]"
"{'id': None, 'name': 'Apfelpage.de'}",Roman van Genabith,Diese iPads sollen iPadOS 18 nicht mehr bekommen,"iPadOS 18 soll wohl nicht mehr alle iPads unterstützen, die zuletzt noch iPadOS 17 erhielten. Geräte, die mit dem A10X Fusion-Chip ausgestattet sind, sollen das Update nicht mehr erhalten, somit würden manche Modelle aus […]
Der Beitrag Diese iPads sollen iPa…",https://www.apfelpage.de/news/diese-ipads-sollen-ipados-18-nicht-mehr-bekommen/,https://www.apfelpage.de/wp-content/uploads/2023/06/Bildschirmfoto-2023-06-05-um-19.43.33-564x317.png,2024-06-10T16:05:36Z,"iPadOS 18 soll wohl nicht mehr alle iPads unterstützen, die zuletzt noch iPadOS 17 erhielten. Geräte, die mit dem A10X Fusion-Chip ausgestattet sind, sollen das Update nicht mehr erhalten, somit würd… [+1678 chars]"
"{'id': None, 'name': 'Maclife.de'}",Jürgen Gorglich,iCloud-Support für virtuelle Maschinen in macOS Sequoia,Apple führt eine bedeutsame Verbesserung in seinem Virtualisierungsframework in macOS Sequoia ein: Mac-Benutzende können sich nun innerhalb von macOS-VMs bei iCloud anmelden. (Weiterlesen),https://www.maclife.de/news/macos-sequoia-icloud-support-vms-aktiviert-100124141.html,https://www.maclife.de/media/maclife/styles/tec_frontend_opengraph/public/images/editors/2024_25/image-124141--4612469.png?itok=BLh6ALwI,2024-06-20T12:32:51Z,"Vorher war es nicht möglich, sich bei iCloud auf macOS-VMs anzumelden, was die Nützlichkeit des Frameworks für Entwicklerinnen und Entwickler, die iCloud-Features testen mussten, sowie für Nutzende, … [+2585 chars]"
"{'id': None, 'name': 'N-tv.de'}",n-tv NACHRICHTEN,Schlag für MAN Energy Solutions: Bund schiebt chinesischer Übernahme Riegel vor,Die Bundesregierung kann Verkäufe ins Nicht-EU-Ausland in bestimmten Fällen untersagen. Beim Gasturbinen-Deal um MAN Energy Solutions mit China greift die Politik nun ein. Das Unternehmen dürfte damit wohl nur noch einen Teil seines Betriebs fortsetzen können.,https://www.n-tv.de/wirtschaft/Chinesen-duerfen-Gasturbinengeschaeft-MAN-Energy-Solutions-nicht-uebernehmen-Habeck-Gefahr-fuer-Sicherheit-article25060466.html,https://bilder3.n-tv.de/img/incoming/crop25060474/1751326674-cImg_16_9-w1200/e2ff45a57b2785826faadaf79474512b.jpg,2024-07-03T12:45:09Z,Die Bundesregierung kann Verkäufe ins Nicht-EU-Ausland in bestimmten Fällen untersagen. Beim Gasturbinen-Deal um MAN Energy Solutions mit China greift die Politik nun ein. Das Unternehmen dürfte dami… [+2209 chars]
"{'id': None, 'name': 'Telepolis.de'}",David Goeßmann,Preiskrieg mit China: Verliert Europa auch bei E-Auto-Batterien den Anschluss?,"China wie Nordamerika drohen Deutschland, Frankreich und Co. abzuhängen. Das liegt an industrieller Planlosigkeit, und ist nicht nur ökonomisch schädlich.",https://www.telepolis.de/features/Preiskrieg-mit-China-Verliert-Europa-auch-bei-E-Auto-Batterien-den-Anschluss-9773085.html,https://heise.cloudimg.io/bound/1200x1200/q85.png-lossy-85.webp-lossy-85.foil1/_www-heise-de_/imgs/18/4/6/1/9/0/4/6/E_Auto_Batterie_Shutter-232f4b73b6404681.jpeg,2024-06-21T22:00:00Z,"Lithiumbatterie und Stromleitungen in Elektrofahrzeug. Bild: Shutterstock.com
China wie Nordamerika drohen Deutschland, Frankreich und Co. abzuhängen. Das liegt an industrieller Planlosigkeit, und i… [+5020 chars]"
"{'id': None, 'name': 'PC Games'}","Olaf Bleich,Benedikt Plass-Fleßenkämper,Lukas Schmid",Five Nights at Freddys: Wie aus einem Ein-Mann-Projekt ein Horror-Welterfolg wurde,"Erst Indie-Horror-Hit auf YouTube, dann Mega-Erfolg an den Kinokassen: Five Nights at Freddys ist längst zur Marke geworden. Wie das Ein-Mann-Projekt so populär wurde, erklären wir in unserer Reportage.",https://www.pcgames.de/Five-Nights-at-Freddys-Spiel-55541/Specials/Five-Nights-at-Freddys-Wie-aus-einem-Ein-Mann-Projekt-ein-Horror-Welterfolg-wurde-1450424/,https://www.pcgames.de/screenshots/original/2024/06/FNAF1_01-1-pc-games_artwork.jpg,2024-06-29T07:00:00Z,"An CD Projekt Reds Science-Fiction-Epos Cyberpunk 2077 arbeiteten mehr als 500 Menschen, an Rockstars Gangster-Drama Grand Theft Auto 5 sogar 1.000. Doch auch in Zeiten, in denen Spiele immer größer … [+5067 chars]"
"{'id': None, 'name': 'Faz.net'}",F.A.Z.,Traditionsunternehmen: Eigentümer stellt WMF neu auf,Das Geschäft mit Haushaltswaren läuft derzeit hierzulande mau. WMF hofft jetzt auf das Geschäft mit Kaffeevollautomaten und Heißluftfriteusen. Stationäre Geschäfte bleiben für das Traditionsunternehmen wichtig.,https://www.faz.net/aktuell/wirtschaft/unternehmen/traditionsunternehmen-eigentuemer-stellt-wmf-neu-auf-19783948.html,https://media1.faz.net/ppmedia/aktuell/962865375/1.9784483/facebook_teaser/fuer-jeden-topf-ein-deckel.jpg,2024-06-12T18:25:56Z,"Almeras hat seit Kurzem den Bereich Deutschland, Österreich und die Schweiz als General Manager unter sich. Denn bei der Württembergischen Metallwarenfabrik stehen die Zeichen auf Umbruch. Nach mehr … [+3900 chars]"
"{'id': 'focus', 'name': 'Focus'}",Von FOCUS-online-Autorin Annika van der Hoek,"Das ist über die Politikerin bekannt - Katrin Göring-Eckardt: Gehalt, Partner und Karriere",Zuletzt machte Katrin Göring-Eckardt mit einem Tweet über den Sieg der deutschen Nationalmannschaft Schlagzeilen. Seit 2021 ist die Grünen-Politikerin wieder Vizepräsidentin des Deutschen Bundestages. Das ist privat über sie bekannt. Von FOCUS-online-Autorin …,https://www.focus.de/politik/das-ist-ueber-die-politikerin-bekannt-katrin-goering-eckardt-gehalt-partner-und-karriere_id_260067506.html,https://p6.focus.de/img/politik/id_260067505/katrin-goering-eckardt-.jpg?im=Crop%3D%280%2C0%2C3771%2C1885%29%3BResize%3D%281200%2C627%29&impolicy=perceptual&quality=mediumHigh&hash=2cc9887add14e521ec2cd9d0d99f4b840d28da6190c198cbfec633efaeff21f8,2024-06-20T14:12:15Z,Zuletzt machte Katrin Göring-Eckardt mit einem Tweet über den Sieg der deutschen Nationalmannschaft Schlagzeilen. Seit 2021 ist die Grünen-Politikerin wieder Vizepräsidentin des Deutschen Bundestages… [+2494 chars]
"{'id': None, 'name': 'PC Games Hardware'}",Norman Wittkopf,Raspberry Pi: Projekt zeigt mobilen Desktop-PC mit Akku-Betrieb,"Unter dem Namen ""Power Pi 2"" hat ein Bastler einen kleinen Desktop-PC auf Basis des Raspberry Pi vorgestellt, der sich zudem auch mobil einsetzen lässt.",https://www.pcgameshardware.de/Raspberry-Pi-Hardware-257637/News/Projekt-zeigt-mobilen-Desktop-PC-mit-Akku-Betrieb-1450407/,https://www.pcgameshardware.de/screenshots/original/2024/06/Raspberry-Pi-Projekt-zeigt-mobilen-Desktop-PC-mit-Akku-Betrieb-pcgh_artwork.jpg,2024-06-27T06:38:00Z,"Der beliebte Einplatinencomputer Raspberry Pi bringt bekanntlich immer wieder interessante Projekte aus der Hardware-Community hervor, von der Retro-Spielekonsole bis hin zum Wakü-Build oder als Best… [+1651 chars]"
"{'id': None, 'name': 'Orf.at'}",ORF.at,Parlament: Rechtsaußen-Parteien vor Fraktionsgründung,,https://orf.at/stories/3362823/,https://orf.at/mojo/1_4_1/storyserver//news/common/images/og-fallback-news.png,2024-07-07T10:43:28Z,"Europas Rechtsaußen-Parteien dürften morgen mit den Patrioten für Europa (PfE) die drittstärkste Fraktion im neuen EU-Parlament ins Leben rufen. Die von der FPÖ, Viktor Orbans ungarischer Fidesz sowi… [+2435 chars]"
"{'id': None, 'name': 'Süddeutsche Zeitung'}","Von Björn Finke, Düsseldorf",Covestro: Arabischer Ölkonzern will Dax-Unternehmen kaufen,Der Kunststoffhersteller Covestro hat ehrgeizige Klimaschutzziele. Ausgerechnet diese Firma soll nun von einem Öl- und Gasförderer aus den Emiraten übernommen werden. Beide Seiten beginnen jetzt konkrete Verhandlungen.,https://www.sueddeutsche.de/wirtschaft/adnoc-covestro-dax-steilemann-chemie-energiepreise-lux.FPywFb37bDEqqNn7tvMF1d,https://www.sueddeutsche.de/2023/12/06/49a9ca3f-12e8-40d6-ba36-ca1f2b080ee4.jpeg?q=60&fm=webp&width=1200&rect=0%2C0%2C1342%2C755,2024-06-24T14:29:08Z,"Das Angebot bewertet Covestro mit 11,7 Milliarden Euro. Es wäre die teuerste Übernahme einer europäischen Firma durch einen arabischen Käufer. Und es wäre das erste Mal, dass ein Dax-Unternehmen von … [+3640 chars]"
"{'id': 'der-tagesspiegel', 'name': 'Der Tagesspiegel'}",Der Tagesspiegel,Juden- und israelfeindlichen Taten : 747 Antisemitismus-Verfahren bei der Berliner Staatsanwaltschaft,"Besonders bei pro-palästinensischen Demonstrationen, aber auch online, gibt es in Berlin viel Hass gegen Israel. Die Staatsanwaltschaft hat nun Zahlen veröffentlicht.",https://www.tagesspiegel.de/berlin/juden-und-israelfeindlichen-taten-747-antisemitismus-verfahren-bei-der-berliner-staatsanwaltschaft-11899568.html,https://www.tagesspiegel.de/images/jahresbericht-des-bundesverbands-rias/alternates/BASE_16_9_W1400/jahresbericht-des-bundesverbands-rias,2024-06-25T13:20:43Z,Die Berliner Generalstaatsanwaltschaft hat vergangenes Jahr 747 Verfahren mit antisemitischem Hintergrund eingeleitet. Im Vorjahr 2022 waren es 691. Allein 158 der aktuellen Verfahren stünden im Zusa… [+1926 chars]
"{'id': None, 'name': 'Faz.net'}",AFP,Paydirekt soll mangels Erfolg abgeschaltet werden,Der Bezahldienst war einst als Konkurrenz zu Paypal angetreten. Doch nun soll Paydirekt laut einem Zeitungsbericht Ende des Jahres endgültig eingestellt werden.,https://www.faz.net/aktuell/wirtschaft/bericht-bezahlverfahren-paydirekt-soll-mangels-erfolg-abgeschaltet-werden-19779485.html,https://media0.faz.net/ppmedia/aktuell/3531324210/1.9779488/facebook_teaser/wohlmoeglich-bald-geschichte.jpg,2024-06-10T15:53:22Z,"Die Zeitung zitierte eine Sprecherin des Bezahldienstes mit den Worten, es gebe Abstimmungen auf Gesellschafterebene zur Zukunft der Paydirekt GmbH als Betreibergesellschaft. Sobald finale Entscheidu… [+477 chars]"
"{'id': None, 'name': 'Www.nzz.ch'}","Guido Schätti (gui), Zoé Baches (ZB)",«Das Angebot war schlicht unanständig»: Unternehmer werfen der UBS Machtmissbrauch vor,"Die Grossbank habe seit der CS-Übernahme ihre Margen erhöht, kritisieren Kunden. Sie fordern Auflagen gegen die Marktmacht der UBS. Die Finma entscheidet in den nächsten Tagen.",https://www.nzz.ch/wirtschaft/das-angebot-war-schlicht-unanstaendig-unternehmer-werfen-der-ubs-machtmissbrauch-vor-ld.1835091,"https://img.nzz.ch/2024/06/15/8604b032-cbbf-4d4b-b13b-274a72a98d26.jpeg?width=1200&height=675&fit=bounds&quality=75&auto=webp&crop=5511,3100,x0,y574&wmark=nzz",2024-06-15T19:45:00Z,"Versprechen gebrochen? Unternehmer werfen der UBS vor, sie nutze ihre Grössenvorteile, um die Gewinne im Heimmarkt Schweiz zu maximieren.
In zwei Wochen vollzieht die UBS die Fusion mit der CS auch … [+7481 chars]"
"{'id': None, 'name': 'Computerwoche.de Live'}","Evan Schuman, Manfred Bremmer",Konsolidierung auf dem IT-Servicemarkt: Kyndryl schielt nach DXC,"Einem Pressebericht zufolge erwägt das IBM-Spinoff Kyndryl, den Konkurrenten DXC Technology zu übernehmen.","https://www.computerwoche.de/a/kyndryl-schielt-nach-dxc,3698822?utm_source=Nach-Artikeltyp_1,30,119,124,125&utm_medium=RSS&utm_campaign=RSS-Feeds",https://images.computerwoche.de/bdb/3392919/640x360.jpg,2024-06-13T15:23:00Z,"Was den Börsenkurs betrifft, ging es mit DXC Technology zuletzt ziemlich bergab. Foto: Piotr Swat - shutterstock.com
Wie die Nachrichtenagentur Reuters unter Berufung auf informierte Kreise berichte… [+3333 chars]"
"{'id': None, 'name': 'N-tv.de'}",n-tv NACHRICHTEN,Konkrete Verhandlungen beginnen: Adnoc stockt Covestro-Gebot auf zwölf Milliarden Euro auf,Die Übernahme des deutschen Chemieriesen Covestro durch einen Energiekonzern aus Abu Dhabi rückt immer näher. ADNOC erhöht seine Offerte auf zwölf Milliarden Euro und will Fakten schaffen - offenbar mit Erfolg. Der DAX-Konzern beginnt mit konkreten Verhandlun…,https://www.n-tv.de/wirtschaft/Covestro-oeffnet-sich-fuer-Adnoc-Offerte-aufgestockt-article25038158.html,https://bilder4.n-tv.de/img/incoming/crop25038159/6191329532-cImg_16_9-w1200/450076327.jpg,2024-06-24T12:55:00Z,Die Übernahme des deutschen Chemieriesen Covestro durch einen Energiekonzern aus Abu Dhabi rückt immer näher. ADNOC erhöht seine Offerte auf zwölf Milliarden Euro und will Fakten schaffen - offenbar … [+3540 chars]
"{'id': None, 'name': 'Visions.de'}",Hannah Rosenthal,"Draußen! Neue Alben von Kasabian, The Backyard Band und mehr","Freitag ist Plattentag – und wir stellen euch wie gewohnt die wichtigsten Neuerscheinungen der Woche vor. Mit Kasabian mehr.

Der Beitrag Die Alben der Woche erschien zuerst auf VISIONS.de.",https://www.visions.de/draussen/die-alben-der-woche-05-07-2024/,https://www.visions.de/wp-content/uploads/Draussen-1.jpg,2024-07-05T07:59:59Z,"Happenings ist das zweite Kasabian-Album mit Serge Pizzorno als Leadsänger und zeigt einen musikalischen Wandel hin zu verzerrten Popsongs, auf denen zwischen Peaches-Electropunk, Discobeats, Red Hot… [+1272 chars]"
"{'id': None, 'name': 'Diepresse.com'}",Die Presse,Missbrauch der Marktstellung: Wettbewerbsbehörde beantragt Geldstrafe gegen Brau Union,Die Bundeswettbewerbsbehörde hat beim Bier-Konzern Brau Union Verstöße gegen Missbrauchs- und Kartellverbot festgestellt. Der Markteintritt konkurrierender Bierhersteller soll beschränkt und bestehende Getränkehändler vom Markt verdrängt worden sein.,https://www.diepresse.com/18578737/missbrauch-der-marktstellung-wettbewerbsbehoerde-beantragt-geldstrafe-gegen-brau-union,https://img.diepresse.com/public/incoming/jxqczg-imago-images-0199505909/alternates/DPR_SOCIAL_NACHRICHTEN/imago%20images%200199505909,2024-06-18T05:54:15Z,Die Bundeswettbewerbsbehörde hat beim Bier-Konzern Brau Union Verstöße gegen Missbrauchs- und Kartellverbot festgestellt. Der Markteintritt konkurrierender Bierhersteller soll beschränkt und bestehen… [+2649 chars]
"{'id': None, 'name': 'Urlaubspiraten.de'}",Marc,NEU: Nonstop nach San Antonio ,SOMMERFERIEN: Direkte Hin- und Rückflüge mit der CONDOR nach Texas  Mega-Roadtrips möglich  Viele Termine im Juli & August,https://www.urlaubspiraten.de/fluege/san-antonio-condor-fm,https://image.urlaubspiraten.de/720/image/upload/v1667405433/mediavault_images/shutterstock_232093318_asknly.jpg,2024-07-01T14:32:00Z,"Zusätzliche Informationen
-----------------
Das solltet ihr in San Antonio und Umgebung nicht verpassen:
Piraten! San Antonio (TX) ist eine der besondersten Städte im Land! Das merkt man von der e… [+6582 chars]"
"{'id': None, 'name': 'Süddeutsche Zeitung'}",Von Max Murke,Uncle Chen: Der schnelle Snack aus Sichuan,Das Uncle Chen in der Heßstraße hat sich auf Dan-Dan-Nudeln spezialisiert. Aber man findet auch andere Überraschungen auf der Karte.,https://www.sueddeutsche.de/muenchen/uncle-chen-china-restaurant-nudeln-muenchen-lux.E3amEysurCYUDdpm8rLxjR,https://www.sueddeutsche.de/2024/06/19/fc21fdd3-bbef-4e67-87b1-2cef8795009b.jpeg?q=60&fm=webp&width=1200&rect=0%2C151%2C4000%2C2250,2024-06-19T14:22:59Z,Das Uncle Chen in der Heßstraße hat sich auf Dan-Dan-Nudeln spezialisiert. Aber man findet auch andere Überraschungen auf der Karte.Unter Münchens Asia-Lokalen hält sich ein Typus besonders hartnäcki… [+412 chars]
"{'id': None, 'name': 'DW (English)'}",Deutsche Welle,EU-Kommission genehmigt Lufthansa-Einstieg bei ITA Airways,"Der deutsche Konzern plant zunächst eine Übernahme von 41 Prozent der italienischen Fluggesellschaft mit der Option, später das gesamte Unternehmen zu kaufen.",https://www.dw.com/de/eu-kommission-genehmigt-lufthansa-einstieg-bei-ita-airways/a-69552198,https://static.dw.com/image/69552168_6.jpg,2024-07-03T15:52:00Z,Europas größter Flugkonzern darf noch größer werden: Für 325 Millionen Euro will die Lufthansa bei dem italienischen Konzern ITA Airways einsteigen. Dafür hat die Fluggesellschaft nun den Segen der e… [+2976 chars]
"{'id': None, 'name': 'Teltarif.de'}",Henning Gajek,SIMon mobile: 6 Monate lang mehr Datenvolumen sichern,"""Weil einfach einfach einfach ist"", ist längst Geschichte. Dafür sorgt Waschbär Simon im Mobilfunk für Aufmerksamkeit. Jetzt gibt es eine Bonus-Aktion für Neukunden.",https://www.teltarif.de/aktion-simon-mobile-neukunden-datenvolumen/news/95839.html,https://www.teltarif.de/img/arch/2024/kw26/aktion-simon-neukunden-datenvolumen-1og.jpg,2024-06-24T14:01:00Z,"Wer erin­nert sich noch an den Slogan ""Weil einfach einfach einfach ist""? Simyo hieß die Marke, die den Mobil­funk komplett auf den Kopf stellte, indem sie alles radikal verein­fachte. Simyo star­tet… [+2866 chars]"
"{'id': None, 'name': 'Mein-deal.com'}",Micha,Nintendo Direct Juni 2024 – keine neue Switch aber viele neue Games!,Gestern war die Nintendo Direct und wir Fans haben uns schon über neue Details und Infos zur neuen Switch gefreut. Aber leider kam aus dieser Richtung,https://www.mein-deal.com/nintendo-direct-juni-2024/,https://www.mein-deal.com/wp-content/uploads//2024/06/Si9IjOb1Hw.jpg,2024-06-19T12:29:07Z,Gestern war die Nintendo Direct und wir Fans haben uns schon über neue Details und Infos zur neuen Switch gefreut. Aber leider kam aus dieser Richtung nichts und wir mussten uns mit den anderen Ankün… [+2503 chars]
"{'id': None, 'name': 'Diepresse.com'}",Die Presse,Rechtsaußen-Parteien dürften drittstärkste Fraktion im EU-Parlament gründen,"Die von der FPÖ, Orbáns ungarischer Fidesz sowie der ANO aus Tschechien neugegründete Gruppe fand in den vergangenen Tagen immer mehr Unterstützung. Interesse gibt es etwa aus Italien, Spanien, den Niederlanden und Portugal.",https://www.diepresse.com/18642051/rechtsaussen-parteien-duerften-drittstaerkste-fraktion-im-eu-parlament-gruenden,https://img.diepresse.com/public/incoming/pqf5mv-kein-Titel/alternates/DPR_SOCIAL_NACHRICHTEN/kein%20Titel,2024-07-06T17:29:56Z,"Die von der FPÖ, Orbáns ungarischer Fidesz sowie der ANO aus Tschechien neugegründete Gruppe fand in den vergangenen Tagen immer mehr Unterstützung. Interesse gibt es etwa aus Italien, Spanien, den N… [+3847 chars]"
