source,author,title,description,url,urlToImage,publishedAt,content
"{'id': None, 'name': 'Süddeutsche Zeitung'}","Von Ulrike Sauer, Rom","Elektromobilität: Ciao, E-Auto! Italiens Absage an die saubere Mobilität der Zukunft",Nach den Europawahlen will Giorgia Meloni nun in Brüssel eine Abkehr von den Klimazielen der EU durchsetzen. In Italien hat ihre Regierung schon mal die zaghafte Autowende abgewürgt.,https://www.sueddeutsche.de/wirtschaft/e-auto-italien-kaufpraemien-stellantis-batteriefabrik-eu-klimaziele-lux.SDQFrqyQSGWa5iEXPDcsxZ,https://www.sueddeutsche.de/2022/06/21/3371cac1-5609-4e83-a1f9-7b2362c12741.jpeg?q=60&fm=webp&width=1200&rect=0%2C52%2C1410%2C793,2024-06-24T09:27:58Z,"In der Zwischenzeit hielt der Autohändler die Kaufaspirantin mit Sprachnachrichten in ihrem Whatsapp-Chat bei der Stange. Noch kann ich Ihnen kein Angebot machen, es ist alles blockiert, sagt er. Ode… [+5827 chars]"
"{'id': None, 'name': 'Telepolis.de'}",Peter Brandt,Demokratie unter Druck: Das Grundgesetz zwischen wirtschaftlichen Interessen und Machtspielen,"Gründung der Bundesrepublik mit Disput zwischen Parteien und Alliierten. Lehren gezogen, Chancen vertan. Was das für heute bedeutet. (Teil 2 und Schluss)",https://www.telepolis.de/features/Demokratie-unter-Druck-Das-Grundgesetz-zwischen-wirtschaftlichen-Interessen-und-Machtspielen-9770417.html,https://heise.cloudimg.io/bound/1200x1200/q85.png-lossy-85.webp-lossy-85.foil1/_www-heise-de_/imgs/18/4/6/1/7/6/5/9/c983a616c556dab7.jpg,2024-06-22T06:00:00Z,"Gründung der Bundesrepublik mit Disput zwischen Parteien und Alliierten. Lehren gezogen, Chancen vertan. Was das für heute bedeutet. (Teil 2 und Schluss)
Die SPD unter der energischen Führung Kurt S… [+13698 chars]"
"{'id': None, 'name': 'Telepolis.de'}",Peter Brandt,Demokratie unter Druck: Das Grundgesetz zwischen wirtschaftlichen Interessen und politischen Machtspielen,"Gründung der Bundesrepublik von Diskussionen zwischen Parteien und Alliierten geprägt. Historische Lehren wurden gezogen, Chancen vertan. Was das für uns heute bedeutet. (Teil 2 und Schuss)",https://www.telepolis.de/features/Demokratie-unter-Druck-Das-Grundgesetz-zwischen-wirtschaftlichen-Interessen-und-politischen-9770417.html,https://heise.cloudimg.io/bound/1200x1200/q85.png-lossy-85.webp-lossy-85.foil1/_www-heise-de_/imgs/18/4/6/1/7/6/5/9/c983a616c556dab7.jpg,2024-06-22T06:00:00Z,"Gründung der Bundesrepublik von Diskussionen zwischen Parteien und Alliierten geprägt. Historische Lehren wurden gezogen, Chancen vertan. Was das für uns heute bedeutet. (Teil 2 und Schuss)
Die SPD … [+13717 chars]"
"{'id': None, 'name': 'Faz.net'}",Michael Ernst,In Phnom Penh eröffnet das Musikzentrum „The Gong“,"Der Fotograf Hannes Schmid wurde durch Musikerbilder berühmt und durch Zigarettenreklame reich. Jetzt engagiert er sich dafür, dass Kambodscha sein kulturelles Gedächtnis nicht verliert.",https://www.faz.net/aktuell/feuilleton/buehne-und-konzert/in-phnom-penh-eroeffnet-das-musikzentrum-the-gong-19818581.html,https://media0.faz.net/ppmedia/aktuell/3602110928/1.9818578/facebook_teaser/das-neue-musikzentrum-the-gong.jpg,2024-06-29T06:21:54Z,"Diese Frage hat sich auch der Fotograf Hannes Schmid gestellt, als er Kambodscha vor Jahren erstmals bereiste. Der durch seine Cowboy-Motive für eine Zigarettenreklame weltweit bekannt gewordene Schw… [+5961 chars]"
"{'id': None, 'name': 'Www.nzz.ch'}",André Müller (amü),KOMMENTAR - Die Finma verzichtet auf Auflagen nach der CS-Übernahme: Das ist keine «Carte blanche» für die UBS,Die Schweizer Behörden machen der Grossbank keine wettbewerbsrechtlichen Auflagen beim Zusammenschluss mit der CS. Die UBS steht dennoch weiter unter Beobachtung und muss sich das Vertrauen verdienen.,https://www.nzz.ch/meinung/finma-zum-wettbewerb-am-bankenplatz-keine-carte-blanche-fuer-ubs-ld.1835768,"https://img.nzz.ch/2024/06/19/d71d2589-2a78-402a-807b-b2cd77ff35fc.jpeg?width=1200&height=675&fit=bounds&quality=75&auto=webp&crop=6090,3426,x0,y1052&wmark=nzz",2024-06-19T12:22:37Z,"Ein Team wie die Schweiz? Die UBS ist nach der CS-Übernahme jedenfalls allgegenwärtig im Land. Sie sollte diese starke Stellung gegenüber ihren Kunden nicht ausnutzen.
Erleichterung bei der letzten … [+3859 chars]"
"{'id': 'der-tagesspiegel', 'name': 'Der Tagesspiegel'}",Alexander Fröhlich,Hamas-Symbol nicht nur an der FU Berlin: Terror-Drohung auch gegen Olaf Scholz und Kai Wegner,Auch der Bundeskanzler und Berlins Regierender Bürgermeister sind in Berlin mit dem roten Hamas-Dreieck markiert worden. Es gilt als Zielsymbol für Terroranschläge.,https://www.tagesspiegel.de/berlin/hamas-symbol-nicht-nur-an-der-fu-berlin-terror-drohung-auch-gegen-olaf-scholz-und-kai-wegner-11816777.html,https://www.tagesspiegel.de/berlin/images/image2jpeg7/alternates/BASE_16_9_W1400/image2jpeg,2024-06-12T18:15:56Z,"Nicht nur dem Präsidenten der Freien Universität (FU), Günter M. Ziegler, wurde mit dem roten Hamas-Dreieck gedroht. Auch Bundeskanzler Olaf Scholz (SPD) und Berlins Regierender Bürgermeister Kai Weg… [+1713 chars]"
"{'id': 'der-tagesspiegel', 'name': 'Der Tagesspiegel'}",Der Tagesspiegel,Mit Armbrust bewaffnet: Wachmann erschießt Angreifer vor israelischer Botschaft in Belgrad,Ein serbischer Wachmann ist bei einem Anschlag auf die Botschaft Israels verletzt worden. Ihm wurde im Krankenhaus ein Pfeil entfernt. Der bislang unidentifizierte Täter ist tot.,https://www.tagesspiegel.de/internationales/mit-armbrust-bewaffnet-wachmann-erschiesst-angreifer-vor-israelischer-botschaft-in-belgrad-11927237.html,https://www.tagesspiegel.de/internationales/images/anschlag-auf-israelische-botschaft-in-belgrad/alternates/BASE_16_9_W1400/anschlag-auf-israelische-botschaft-in-belgrad.jpeg,2024-06-29T13:45:47Z,"Ein bisher nicht identifizierter Täter hat am Samstag mit einer Armbrust auf einen serbischen Wachbeamten der israelischen Botschaft in Belgrad geschossen. 
Der Gendarm, der von dem Pfeil am Hals ge… [+2013 chars]"
"{'id': 'der-tagesspiegel', 'name': 'Der Tagesspiegel'}",Steffi Pyanoe,Wochenendtipps für Potsdam: Ein Wochenende ohne Fußball ist möglich,"Wem der Sinn nach Unterhaltung steht, findet am Wochenende (14.-16.6.) in Potsdam ein reichhaltiges Programm.",https://www.tagesspiegel.de/potsdam/landeshauptstadt/wochenendtipps-fur-potsdam-ein-wochenende-ohne-fussball-ist-moglich-11821271.html,https://www.tagesspiegel.de/images/166211555696011599b3c-a0f2-4490-8aac-f84f452579835/alternates/BASE_16_9_W1400/166211555696011599b3c-a0f2-4490-8aac-f84f452579835,2024-06-13T11:47:49Z,"Los gehts heute (Freitag, 14.6.) bei der After-Work Lounge mit Ausstellungseröffnung im Bistro Backstoltz in der Dortustraße 59. Ab 18 Uhr werden Tusche-Zeichnungen der Potsdamer Malerin Heike Isenma… [+1746 chars]"
"{'id': 'focus', 'name': 'Focus'}",Deutsche Welle Wirtschaft,Aktuelles - EU-Kommission genehmigt Lufthansa-Einstieg bei ITA Airways,"Der deutsche Konzern plant zunächst eine Übernahme von 41 Prozent der italienischen Fluggesellschaft mit der Option, später das gesamte Unternehmen zu kaufen.",https://www.focus.de/finanzen/news/aktuelles-eu-kommission-genehmigt-lufthansa-einstieg-bei-ita-airways_id_260106574.html,https://p6.focus.de/img/finanzen/news/id_260106573/ita-praesident-antonino-turicchi-links-wirtschaftsminister-giancarlo-giorgetti-mitte-und-lufthansa-chef-carsten-spohr-in-rom.jpg?im=Crop%3D%280%2C29%2C940%2C470%29%3BResize%3D%281200%2C627%29&impolicy=perceptual&quality=mediumHigh&hash=2539118b405fec94832492a0bcac6d8f03841a7b34bb4db30603c71508ae253c,2024-07-03T16:20:04Z,Europas größter Flugkonzern darf noch größer werden: Für 325 Millionen Euro will die Lufthansa bei dem italienischen Konzern ITA Airways einsteigen. Dafür hat die Fluggesellschaft nun den Segen der e… [+2739 chars]
"{'id': 'der-tagesspiegel', 'name': 'Der Tagesspiegel'}",Alexander Fröhlich,Nach Panne bei Berlins Demo-Datenbank: Polizei erwägt Motto-Check für Kundgebungen,"Die Berliner Polizei veröffentlichte in ihrer Demo-Datenbank eine antiisraelische Versammlung, deren Motto den Holocaust verharmloste und wohl strafbar ist. Nun überprüft die Polizei die bisherigen Abläufe.",https://www.tagesspiegel.de/berlin/nach-panne-bei-berlins-demo-datenbank-polizei-erwagt-motto-check-fur-kundgebungen-11935193.html,https://www.tagesspiegel.de/images/pro-palestine-protest-in-berlin-may-18-protesters-wave-palestinian-flags-during-a-pro-palestine-demonstration-held-in-be/alternates/BASE_16_9_W1400/pro-palestine-protest-in-berlin-may-18-protesters-wave-palestinian-flags-during-a-pro-palestine-demonstration-held-in-be.jpeg,2024-07-01T12:27:49Z,Die Berliner Polizei korrigiert nach einer Panne ihren Umgang bei der Veröffentlichung von Demonstrationsmottos. Die Panne ist auch Folge einer Regel im von Rot-Rot-Grün 2021 durchgesetzten Versammlu… [+3896 chars]
"{'id': 'bild', 'name': 'Bild'}",Christin Martens,Lapee-Erfinderin Gina Périer - „Die Farbe Pink macht meine Frauen-Urinale sicher“,"Klo für Frauen: Firmengründerin Gina Périer (30) erzählt in BILD, wie aus einer schockierenden Festival-Erfahrung die Hock-Urinale „Lapee“ wurden.",https://www.bild.de/geld/wirtschaft/erfinderin-von-lapee-pink-macht-wc-fuer-frauen-auf-festivals-sicher-66742d280a2a6d5693d07254,"https://images.bild.de/66742d280a2a6d5693d07254/63ea00eae5e218b8cf45b6a0cc47574e,6433b91d?w=1280",2024-06-21T11:55:00Z,"Jetzt kommt die Pink(el)-Pause  Mit seiner geschwungenen Form fällt es schon von Weitem auf. In den drei runden Flügeln befindet sich jeweils ein Urinal.
Über eine kleine Treppe gelangt man zu einer… [+3475 chars]"
"{'id': None, 'name': 'Faz.net'}",Jan Schiefenhövel,Stadt und Konzern einig: Fusion der Darmstädter Krankenhäuser kommt voran,Die Stadt und der evangelische Gesundheitskonzern Agaplesion wollen sich zusammenschließen und ihre Krankenhäuser gemeinsam führen. Eine Absichtserklärung ist nun unterschrieben.,https://www.faz.net/aktuell/rhein-main/region-und-hessen/fusion-der-darmstaedter-krankenhaeuser-mit-konzern-agaplesion-kommt-voran-19834819.html,https://media1.faz.net/ppmedia/aktuell/1900533664/1.9834817/facebook_teaser/viel-platz-der-neubau-des.jpg,2024-07-04T17:10:53Z,"Demnach ist geplant, dass der Stadt Darmstadt und der Agaplesion gAG je 50 Prozent dieser Holdinggesellschaft gehören werden. Die beiden Gesellschafter geben ihre Krankenhäuser zu 60 Prozent an die H… [+2653 chars]"
"{'id': None, 'name': 'heise online'}",Matthias Parbel,DevSecOps und MLOps vereint: JFrog übernimmt ML-Plattform Qwak​,Mit der Akquise von Qwak will JFrog die Lücke zwischen MLOps und DevSecOps schließen. DevOps-Teams sollen KI-Anwendungen schneller entwickeln.​,https://www.heise.de/news/DevSecOps-und-MLOps-vereint-JFrog-uebernimmt-ML-Plattform-Qwak-9779567.html,https://heise.cloudimg.io/bound/1200x1200/q85.png-lossy-85.webp-lossy-85.foil1/_www-heise-de_/imgs/18/4/6/2/2/4/4/9/Frosch-auf-Ente-auf-Teich_1280x1024-d872a386a8c0b731.png,2024-06-26T15:03:00Z,"JFrog, Anbieter der gleichnamigen Software-Supply-Chain-Plattform, hat die Übernahme von Qwak AI vollzogen. Die vor rund vier Jahren geründete Firma Qwak ist darauf spezialisiert, Data Scientists bei… [+2522 chars]"
"{'id': None, 'name': 'heise online'}",Timothey Krechel,Die Produktwerker: AARRR-Modell – Wie die Pirate Metrics Product Ownern helfen,AARRR! Ein Pirat? Nein! Es sind die Pirate Metrics. Timothey Krechel erklärt in dieser Podcast-Folge das AARRR-Modell.,https://www.heise.de/blog/Die-Produktwerker-AARRR-Modell-Wie-die-Pirate-Metrics-Product-Ownern-helfen-9765581.html?wt_mc=rss.red.ho.ho.atom.beitrag.beitrag,https://heise.cloudimg.io/bound/1200x1200/q85.png-lossy-85.webp-lossy-85.foil1/_www-heise-de_/imgs/18/4/6/1/5/1/1/4/produktwerker-3f367273bb52c1f5.png,2024-06-17T08:44:00Z,Was sind Pirate Metrics? Das auch als das AARRR-Modell bekannte Set von Metriken hat vor allem im Bereich des Growth Marketing starke Verbreitung und Bekanntheit. Produktwerker Tim Klein hat in diese… [+2252 chars]
"{'id': None, 'name': 'Zdnet.de'}",Stefan Beiersmann,App-Marktplätze: EU leitet Wettbewerbsverfahren gegen Apple ein,Es geht um die Auflagen für die Weiterleitung von Verbrauchern zu Angeboten außerhalb des Apple App Store. Die EU nimmt auch Apples Core Technology Fee ins Visier.,https://www.zdnet.de/88416675/app-marktplaetze-eu-leitet-wettbewerbsverfahren-gegen-apple-ein/,https://www.zdnet.de/wp-content/themes/korasa-zdnet-de/images/zdnet-logo.png,2024-06-25T06:12:04Z,"Die EU-Kommission wirft AppleVerstöße gegen den Digital Markets Act (DMA) vor. Das Unternehmen aus Cupertino soll App-Entwickler in ihren Möglichkeiten einschränken, Verbraucher über Angebote und Inh… [+1891 chars]"
"{'id': None, 'name': 'Www.nzz.ch'}",Matthias Benz (mbe),Nicht nur Caffè Latte und Käse: Emmi übernimmt einen Dessert-Hersteller in Frankreich,Der grösste Schweizer Milchverarbeiter baut sein Dessert-Geschäft aus. Der französische Hersteller Mademoiselle Desserts beliefert vor allem Bäckereien und Grossküchen.,https://www.nzz.ch/wirtschaft/nicht-nur-caffe-latte-und-kaese-emmi-uebernimmt-einen-dessert-hersteller-in-frankreich-ld.1838243,"https://img.nzz.ch/2024/07/05/61fb1fa1-f56b-42b9-82ce-bfde67031757.jpeg?width=1200&height=675&fit=bounds&quality=75&auto=webp&crop=2048,1152,x0,y98&wmark=nzz",2024-07-05T09:03:10Z,"Neben Käse verkauft Emmi zunehmend auch Desserts.
In der Schweiz ist Emmi vor allem bekannt für Caffè Latte, Käse oder Joghurts. Dabei geht gerne vergessen, dass der grösste Schweizer Milchverarbeit… [+2524 chars]"
"{'id': None, 'name': 'Orf.at'}",ORF.at,BAWAG schluckt deutsches Barclays-Privatkundengeschäft,,https://orf.at/stories/3362544/,https://orf.at/mojo/1_4_1/storyserver//news/common/images/og-fallback-news.png,2024-07-04T07:19:10Z,"Die BAWAG Group kauft das deutsche Privatkundengeschäft der britischen Großbank Barclays. Mit dem Zukauf will die Bank ihre Präsenz in Österreich, Deutschland, der Schweiz und den Niederlanden ausbau… [+726 chars]"
"{'id': None, 'name': 'heise online'}",Timothey Krechel,Die Produktwerker: AARRR-Modell – Wie die Pirate Metrics Product Ownern helfen,AARRR! Ein Pirat? Nein! Es sind die Pirate Metrics. Timothey Krechel erklärt in dieser Podcast-Folge das AARRR-Modell.,https://www.heise.de/blog/Die-Produktwerker-AARRR-Modell-Wie-die-Pirate-Metrics-Product-Ownern-helfen-9765581.html?wt_mc=rss.red.developer.developer.atom.beitrag.beitrag,https://heise.cloudimg.io/bound/1200x1200/q85.png-lossy-85.webp-lossy-85.foil1/_www-heise-de_/imgs/18/4/6/1/5/1/1/4/produktwerker-3f367273bb52c1f5.png,2024-06-17T08:44:00Z,Was sind Pirate Metrics? Das auch als das AARRR-Modell bekannte Set von Metriken hat vor allem im Bereich des Growth Marketing starke Verbreitung und Bekanntheit. Produktwerker Tim Klein hat in diese… [+2252 chars]
"{'id': None, 'name': 'Deutsche-startups.de'}",Team,"#Gastbeitrag - Startups vor der Übernahme: 4 Tipps, damit alles glatt läuft","Die Übernahme durch ein anderes Unternehmen sollte als gemeinsamer Integrationsprozess verstanden werden. Die Frage, wie dieser möglichst angenehm für alle Beteiligten gestaltet werden kann, gehört bereits in die Verhandlungen im Vorfeld. Ein Gastbeitrag von …",https://www.deutsche-startups.de/2024/06/25/tupps-startups-uebernahme/,https://www.deutsche-startups.de/app/uploads/2024/03/ds-exit-gruender-ki.jpg,2024-06-25T11:55:23Z,"Die Übernahme durch eine große, international agierende Unternehmensgruppe ist ein ganz besonderer Meilenstein im Leben eines Startups. In den Übernahme-Verhandlungen werden die Details geklärt doch … [+5121 chars]"
"{'id': None, 'name': 'Businessinsider.de'}",Nina Anika Klotz,Es geht wieder los: Nach der Flaute sieht die Startupszene wieder Exits – 5 Beispiele aus dem Juni,Pitchbook verzeichnet einen Rückgang der Exits um die Hälfte. Jetzt könnte sich das ändern: Fünf nennenswerte Exits allein im Juni,https://www.businessinsider.de/gruenderszene/perspektive/es-geht-wieder-los-nach-der-flaute-sieht-die-startupszene-wieder-exits-5-beispiele-aus-dem-juni/,https://cdn.businessinsider.de/wp-content/uploads/2024/06/202407_GS_Artikel_Exit_1800x1200.jpg?ver=1719926664,2024-07-05T04:00:00Z,47 Prozent weniger Exits gab es europaweit im ersten Quartal 2024 im Vergleich zum Vorjahreszeitraum. Jetzt könnte sich das ändern: Diese Exits gab es allein um Juni.Bereits im vergangenen Jahr gab e… [+7254 chars]
"{'id': None, 'name': 'CHIP Online Deutschland'}",,Chrome OS: So erobert Google die Geschäftswelt,"Google verbessert Chrome OS für den geschäftlichen Einsatz. Durch die Akquise des Spezialisten für Virtualisierung, Cameyo, plant der Internetriese die Kompatibilität mit Windows-Software erheblich zu steigern.",https://www.chip.de/news/software/chrome-os-so-erobert-google-die-geschaeftswelt_dacb9f91-f4ba-4528-a1d7-270aafcf118a.html,https://quadro.burda-forward.de/ctf/4197441c-d797-4dcb-a5d3-80bc5d6697a8.d05767ec-1379-4132-8ca2-eac8759e883f.png?im=RegionOfInterestCrop%3D%281200%2C630%29%2CregionOfInterest%3D%281271%2C565%29&hash=1c44f67cc91925e22da46730c517e2a36d3de777dc70bd979bd5b8454ec5f76a,2024-06-11T08:24:00Z,"Die Schlüsseltechnologie: Cameyos Virtual App Delivery (VAD) erlaubt das reibungslose Ausführen von Windows-Programmen auf Chrome OS-Geräten ohne die Notwendigkeit, ein vollständiges Windows-System z… [+1306 chars]"
"{'id': None, 'name': 'Computerwoche.de Live'}","Evan Schuman, Manfred Bremmer",Konsolidierung auf dem IT-Servicemarkt: Kyndryl schielt nach DXC,"Einem Pressebericht zufolge erwägt das IBM-Spinoff Kyndryl, den Konkurrenten DXC Technology zu übernehmen.","https://www.computerwoche.de/a/kyndryl-schielt-nach-dxc,3698822?utm_source=Nach-Artikeltyp_1,30,119,124,125&utm_medium=RSS&utm_campaign=RSS-Feeds",https://images.computerwoche.de/bdb/3392919/640x360.jpg,2024-06-13T15:23:00Z,"Was den Börsenkurs betrifft, ging es mit DXC Technology zuletzt ziemlich bergab. Foto: Piotr Swat - shutterstock.com
Wie die Nachrichtenagentur Reuters unter Berufung auf informierte Kreise berichte… [+3333 chars]"
"{'id': None, 'name': 'Www.nzz.ch'}",Dominik Feldges (df),Big Pharma muss sparen. Auf die Branche rollt eine Entlassungswelle zu,"Die stark gestiegene Inflation sowie der wachsende Druck auf Medikamentenpreise zwingen Pharmafirmen, ihre Kosten zu senken. Takeda, Pfizer, Roche und Novartis bauen in der Schweiz zusammen Hunderte von Stellen ab.",https://www.nzz.ch/wirtschaft/big-pharma-in-der-schweiz-fallen-hunderte-von-stellen-weg-ld.1836054,"https://img.nzz.ch/2024/06/21/4ef90ed5-d679-4cf4-b2c0-e8629086b712.jpeg?width=1200&height=675&fit=bounds&quality=75&auto=webp&crop=8256,4644,x0,y131&wmark=nzz",2024-06-22T19:45:00Z,"In seinem Forschungszentrum in Schlieren verkleinert der Basler Pharmakonzern Roche die Belegschaft tröpfchenweise.
Der japanische Pharmariese Takeda hat sich beim Umbau seiner Zentrale in Opfikon n… [+8259 chars]"
"{'id': None, 'name': 'Www.nzz.ch'}",Janique Weder (wej),They Are the Champions: Der Musikkatalog von Queen soll für mehr als eine Milliarde Dollar an Sony Music gehen,They Are the Champions: Der Musikkatalog von Queen soll für mehr als eine Milliarde Dollar an Sony Music gehen,https://www.nzz.ch/wirtschaft/queen-musikkatalog-sony-music-bietet-mehr-als-eine-milliarde-dollar-ld.1836217,"https://img.nzz.ch/2023/09/06/75825380-6d43-476b-a481-55adaf72e3e0.jpeg?width=1200&height=675&fit=bounds&quality=75&auto=webp&crop=5189,2919,x0,y267&wmark=nzz",2024-06-21T14:40:41Z,"Der Musikkatalog von Queen gehört zu den wertvollsten der Welt.
Im Jahr 1977 ist Queens «We Are the Champions» erschienen und seither von Siegerehrungen aller Art nicht mehr wegzudenken. Die wahren … [+3492 chars]"
"{'id': None, 'name': 'Diepresse.com'}",Die Presse,Post-Chef Pölzl zu Regulierung durch Lieferkettengesetz und Co.: „Das ist nicht mehr normal“,"15 Jahre stand Georg Pölzl an der Spitze der teilstaatlichen österreichischen Post. Mitte August tritt er ab. In die Politik will er nicht, in Pension gehen will er aber auch nicht.",https://www.diepresse.com/18602915/post-chef-poelzl-zu-regulierung-durch-lieferkettengesetz-und-co-das-ist-nicht-mehr-normal,https://img.diepresse.com/public/incoming/hklgsh-kein-Titel/alternates/DPR_SOCIAL_NACHRICHTEN/kein%20Titel,2024-06-25T11:03:58Z,"15 Jahre stand Georg Pölzl an der Spitze der teilstaatlichen österreichischen Post. Mitte August tritt er ab. In die Politik will er nicht, in Pension gehen will er aber auch nicht. 
Post-Chef Georg… [+6146 chars]"
"{'id': None, 'name': 'GlobeNewswire'}",BAWAG Group AG,BAWAG erwirbt Barclays Consumer Bank Europe,Die BAWAG Group gibt heute die Unterzeichnung einer Transaktion zum Erwerb des deutschen Privatkundengeschäfts von Barclays („Barclays Consumer Bank Europe“) mit Sitz in Hamburg von der Barclays Bank Ireland PLC bekannt.,https://www.globenewswire.com/news-release/2024/07/04/2908546/0/de/BAWAG-erwirbt-Barclays-Consumer-Bank-Europe.html,https://ml-eu.globenewswire.com/Resource/Download/0268b39d-1ebd-4b74-98b5-99f299a32df2,2024-07-04T06:30:00Z,Die BAWAG Group gibt heute die Unterzeichnung einer Transaktion zum Erwerb des deutschen Privatkundengeschäfts von Barclays (Barclays Consumer Bank Europe) mit Sitz in Hamburg von der Barclays Bank I… [+6296 chars]
"{'id': None, 'name': '[Removed]'}",,[Removed],[Removed],https://removed.com,,1970-01-01T00:00:00Z,[Removed]
"{'id': None, 'name': 'Computerwoche.de Live'}",COMPUTERWOCHE,GenAI in der Software-Entwicklung: Wie Now Assist die Entwicklungszeiten bei snacc-it verkürzt,"Der ServiceNow-Partner nutzt Now Assist for Creator, um Prototypen schneller erstellen zu können. Doch das ist er der Anfang seiner KI-Reise.","https://www.computerwoche.de/a/wie-now-assist-die-entwicklungszeiten-bei-snacc-it-verkuerzt,3698880?utm_source=Nach-Artikeltyp_1,30,119,124,125&utm_medium=RSS&utm_campaign=RSS-Feeds",https://images.computerwoche.de/bdb/3393082/640x360.jpg,2024-07-02T03:06:00Z,"Die Zeitersparnis, die snacc-it durch die Nutzung von Now Assist erzielt, ist der offensichtliche Benefit, aber bei weitem nicht der einzige. Foto: Gorodenkoff - shutterstock.com
Die meisten Unterne… [+7507 chars]"
"{'id': None, 'name': 'Www.nzz.ch'}",Dominik Feldges (df),Jean-Paul Clozel will nichts von einem Verkauf der Biotechfirma Idorsia wissen,Die Veräusserung von Actelion verhalf dem Ärztepaar Jean-Paul und Martine Clozel zu einem Milliardenvermögen. Ihre zweite Firma Idorsia schreibt hohe Verluste. Ein abermaliger Ausstieg kommt für die beiden aber nicht infrage.,https://www.nzz.ch/wirtschaft/biotechnologie-jean-paul-clozel-will-keinen-verkauf-von-idorsia-ld.1834953,"https://img.nzz.ch/2024/06/13/3765edc5-c194-461e-80b7-0ea9dc0f3364.jpeg?width=1200&height=674&fit=bounds&quality=75&auto=webp&crop=4056,2281,x0,y238&wmark=nzz",2024-06-14T03:30:00Z,"Bei der Allschwiler Biotechfirma Idorsia verloren letztes Jahr fast 500 Angestellte ihren Arbeitsplatz.
Jean-Paul Clozel kann einem leidtun, wie er, den Rollator neben sich, in einem kleinen Saal de… [+5851 chars]"
"{'id': None, 'name': 'Www.nzz.ch'}",Benjamin Triebe (bet),«Eine Herkulesaufgabe»: So baut Nils Planzer den grössten privaten Gegenentwurf zur Post,Der Logistiker Planzer hat sich viel aufgeladen. Sechs Jahre nach dem Start ist das Paketgeschäft noch nicht rentabel – und die neu erworbene Briefzustellung wird es vielleicht nie sein.,https://www.nzz.ch/wirtschaft/planzer-das-will-der-groesste-private-post-konkurrent-mit-quickpac-und-quickmail-ld.1831373,"https://img.nzz.ch/2024/06/17/4f969ade-aa4f-457b-a23b-0379c3484032.jpeg?width=1200&height=675&fit=bounds&quality=75&auto=webp&crop=8192,4608,x0,y753&wmark=nzz",2024-06-23T03:30:00Z,"Nils Planzer sagt, er brauche noch Zeit, um das mit Quickmail übernommene Briefgeschäft zu verstehen.
Für jemanden, der sich als konservativer Unternehmer bezeichnet, ist Nils Planzer sehr entschlus… [+9079 chars]"
"{'id': None, 'name': 'Diepresse.com'}",Die Presse,BAWAG übernimmt deutsches Barclays-Privatkundengeschäft,"Die Bank will damit ihre Präsenz in Österreich, Deutschland, der Schweiz und den
Niederlanden ausbauen.",https://www.diepresse.com/18633245/bawag-uebernimmt-deutsches-barclays-privatkundengeschaeft,https://img.diepresse.com/public/incoming/wphsob-imago0238143023h.jpg/alternates/DPR_SOCIAL_NACHRICHTEN/imago0238143023h.jpg,2024-07-04T07:50:46Z,"Die Bank will damit ihre Präsenz in Österreich, Deutschland, der Schweiz und denNiederlanden ausbauen.
Die BAWAG Group kauft das deutsche Privatkundengeschäft der britischen Großbank Barclays. Mit d… [+1169 chars]"
"{'id': None, 'name': 'N-tv.de'}",n-tv NACHRICHTEN,Aus der Dunkelheit an die Spitze: Dallas Mavericks spielt gegen die 0:156-Bilanz an,"Es hat lange gedauert, aber die Dallas Mavericks sind zum ersten Mal seit der glorreichen Dirk Nowitzki Ära wieder in der Belle Etage der NBA angekommen. Mit Luka Dončić wollen sich die Texaner wieder langfristig unter den Besten der Besten festsetzen.",https://www.n-tv.de/sport/NBA-Dallas-Mavericks-kommen-aus-dem-tiefen-Tal-und-spielen-gegen-die-0-156-Bilanz-an-article25014739.html,https://bilder1.n-tv.de/img/incoming/crop25014784/2261326030-cImg_16_9-w1200/a1832223323a9a728371cc8bc3609bcd.jpg,2024-06-14T11:53:25Z,"Es hat lange gedauert, aber die Dallas Mavericks sind zum ersten Mal seit der glorreichen Dirk Nowitzki Ära wieder in der Belle Etage der NBA angekommen. Mit Luka Doni wollen sich die Texaner wieder … [+13669 chars]"
